repo,topics,language,id,description,url,doc_source,score,is_a_curated_list,is_not_a_library
spotify/magnolify,"['avro', 'bigquery', 'bigtable', 'cats', 'datastore', 'guava', 'magnolia', 'neo4j', 'parquet', 'protobuf', 'scala', 'scalacheck', 'tensorflow']",Scala,9411101f-bd96-5f6d-bd7b-bd88469c8751,A collection of Magnolia add-on modules,https://github.com/spotify/magnolify,readme,0,,
litestar-org/polyfactory,"['beanie', 'dataclasses', 'hacktoberfest', 'litestar', 'msgspec', 'odmantic', 'polyfactory', 'pydantic', 'pydantic-factories', 'python', 'starlite', 'typeddict']",Python,38e3654f-05d0-5297-bcb1-fc7f25cb41fb,Simple and powerful factories for mock data generation,https://github.com/litestar-org/polyfactory,readme,0,,
ray-project/llm-numbers,[],,a06aaed3-5a30-5d92-8abd-ec704b57b5c6,Numbers every LLM developer should know,https://github.com/ray-project/llm-numbers,readme,0,,
zilliztech/GPTCache,"['aigc', 'autogpt', 'babyagi', 'chatbot', 'chatgpt', 'chatgpt-api', 'dolly', 'gpt', 'langchain', 'llama', 'llama-index', 'llm', 'memcache', 'milvus', 'openai', 'redis', 'semantic-search', 'similarity-search', 'vector-search']",Python,2ba00e40-704d-573d-a020-ad6da4057562,Semantic cache for LLMs. Fully integrated with LangChain and llama_index.,https://github.com/zilliztech/GPTCache,readme,0,,
NVIDIA-Merlin/models,"['dask', 'deep-learning', 'gpu', 'machine-learning', 'pytorch', 'rapidsai', 'recommendation-system', 'recommender-system', 'recsys', 'tensorflow']",Python,e032b938-4f67-55c6-8815-30139697c5bc,Merlin Models is a collection of deep learning recommender system model reference implementations,https://github.com/NVIDIA-Merlin/models,readme,0,,
facebookresearch/fairscale,[],Python,473dfecf-6756-5047-a415-03728809a7f3,PyTorch extensions for high performance and large scale training.,https://github.com/facebookresearch/fairscale,readme,0,,
pallets/quart,"['asgi', 'asyncio', 'flask', 'jinja', 'python', 'quart', 'web-framework']",Python,4958c5e0-54c0-501b-836c-8cac52f36c88,An async Python micro framework for building web applications.,https://github.com/pallets/quart,readme,0,,
OML-Team/open-metric-learning,"['computer-vision', 'data-science', 'deep-learning', 'hacktoberfest', 'hacktoberfest-2023', 'hacktoberfest2023', 'metric-learning', 'pytorch', 'pytorch-lightning', 'representation-learning', 'similarity-learning']",Python,ecc816aa-b930-5364-8a8a-f55580315cfe,"Metric learning and retrieval pipelines, models and zoo.",https://github.com/OML-Team/open-metric-learning,readme,0,,
VoltaML/voltaML,[],Python,07bbfdf6-3956-59c3-a6ec-75bb89079cfc,"⚡VoltaML is a lightweight library to convert and run your ML/DL deep learning models in high performance inference runtimes like TensorRT, TorchScript, ONNX and TVM.",https://github.com/VoltaML/voltaML,readme,0,,
huggingface/setfit,"['few-shot-learning', 'nlp', 'sentence-transformers']",Jupyter Notebook,bbc24783-1612-5617-8fc1-6f7edfd98543,Efficient few-shot learning with Sentence Transformers,https://github.com/huggingface/setfit,readme,0,,
rawandahmad698/PyChatGPT,"['chatgpt', 'openai', 'python']",Python,a434bce6-73a0-5cf0-af00-f343131c60d8,"⚡️ Python client for the unofficial ChatGPT API with auto token regeneration, conversation tracking, proxy support and more.",https://github.com/rawandahmad698/PyChatGPT,readme,0,,
dabeaz-course/python-mastery,"['python', 'python-tutorial', 'tutorial']",Python,17d0b0b8-4ff9-5667-8e9d-36ebc6a7b2e4,Advanced Python Mastery (course by @dabeaz),https://github.com/dabeaz-course/python-mastery,readme,0,,
actionml/harness,[],Scala,6c2e7250-5c9d-5de0-9d56-28f5398e9c6e,Harness is a Machine Learning/AI Server with plugins for many algorithms including the Universal Recommender,https://github.com/actionml/harness,readme,0,,
nikdon/pyEntropy,"['entropy', 'multiscale', 'numpy', 'permutation', 'python', 'sample']",Python,dd931a9e-5ff5-53c0-a1c8-c54214e64df1,Entropy for Python,https://github.com/nikdon/pyEntropy,readme,0,,
yahoojapan/NGT,"['approximate-nearest-neighbor-search', 'k-nearest-neighbors', 'knn-search', 'nearest-neighbor-search', 'nearest-neighbors']",C++,874adc4a-6a47-5412-94ac-0368c3cf5291,Nearest Neighbor Search with Neighborhood Graph and Tree for High-dimensional Data,https://github.com/yahoojapan/NGT,readme,0,,
sqlalchemy/sqlalchemy,"['python', 'sql', 'sqlalchemy']",Python,9a17eb0d-3aee-51c1-8bf4-4765259ff087,The Database Toolkit for Python,https://github.com/sqlalchemy/sqlalchemy,readme,0,,
pandas-ml/pandas-ml,[],Python,5b9d7632-92dd-52bd-9421-ae17cc9d0ef9,"pandas, scikit-learn, xgboost and seaborn integration ",https://github.com/pandas-ml/pandas-ml,readme,0,,
duckdb/duckdb,"['analytics', 'database', 'embedded-database', 'olap', 'sql']",C++,f1fcb981-428a-5fd0-a03a-c718da8b6fb2,DuckDB is an analytical in-process SQL database management system,https://github.com/duckdb/duckdb,readme,0,,
biobootloader/wolverine,[],Python,cb3762cd-6a8b-54b0-af76-93331887bd32,,https://github.com/biobootloader/wolverine,readme,0,,
aniketmaurya/llm-inference,"['chatbot', 'langchain', 'llama', 'llm', 'llm-inference', 'mistral']",Python,35c31310-77a2-5e17-880c-d512968f98e1,Large Language Model (LLM) Inference API and Chatbot,https://github.com/aniketmaurya/llm-inference,readme,0,,
g8a9/ferret,"['benchmarking', 'interpretability', 'machine-learning', 'transformers']",Python,19f3b6ef-d55d-5cdd-9219-71a1a76a7bca,A python package for benchmarking interpretability techniques on Transformers.,https://github.com/g8a9/ferret,readme,0,,
alibaba/EasyRec,"['autoint', 'automl', 'capsule-network', 'ctr-prediction', 'deepfm', 'deepmatching', 'din', 'dlrm', 'dssm', 'eges', 'esmm', 'mind', 'multi-task-learning', 'online-learning', 'pdn', 'recommendation-algorithms', 'recommender-system', 'transformers-models', 'wide-and-deep']",Python,0dd01f1f-6aca-5dac-813c-0499b28b9946,A framework for large scale recommendation algorithms.,https://github.com/alibaba/EasyRec,readme,0,,
SurrealAI/surreal,[],Python,f1e3842b-9c33-5afe-ac29-88c039025206,Open-Source Distributed Reinforcement Learning Framework by Stanford Vision and Learning Lab,https://github.com/SurrealAI/surreal,readme,0,,
keras-rl/keras-rl,"['keras', 'machine-learning', 'neural-networks', 'reinforcement-learning', 'tensorflow', 'theano']",Python,4ba06d78-708c-5f62-8095-46c4e2a9c531,Deep Reinforcement Learning for Keras.,https://github.com/keras-rl/keras-rl,readme,0,,
pathwaycom/pathway,"['batch-processing', 'data-analytics', 'data-pipelines', 'data-processing', 'dataflow', 'etl', 'etl-framework', 'iot-analytics', 'kafka', 'machine-learning-algorithms', 'pathway', 'python', 'real-time', 'rust', 'stream-processing', 'streaming', 'time-series-analysis']",Python,f36b0f00-f19d-5159-95d1-259af1aaee40,"Python ETL framework for stream processing, real-time analytics, LLM pipelines, and RAG.",https://github.com/pathwaycom/pathway,readme,0,,
nscala-time/nscala-time,"['datetime', 'joda', 'scala']",Scala,8ff2952b-5df9-5abc-b842-421b4a8d4e5e,A new Scala wrapper for Joda Time based on scala-time,https://github.com/nscala-time/nscala-time,readme,0,,
reactivecodes/scala-time,[],Scala,aad518da-ff28-589e-864b-2dc27935a4c7,Scala friendly wrapper for java.time and ThreeTen BP,https://github.com/reactivecodes/scala-time,readme,0,,
Jingjing-NLP/KNAS,[],Python,235b31a7-346b-573e-8104-ede15990d6ce,"Codes for paper ""KNAS: Green Neural Architecture Search""",https://github.com/Jingjing-NLP/KNAS,readme,0,,
lencx/ChatGPT,"['ai', 'app', 'application', 'chatgpt', 'desktop-app', 'gpt', 'gpt-3', 'linux', 'macos', 'notes-app', 'openai', 'rust', 'tauri', 'webview', 'windows']",Rust,ce7b7a70-0027-59ce-a676-016fb48369dd,"🔮 ChatGPT Desktop Application (Mac, Windows and Linux)",https://github.com/lencx/ChatGPT,readme,0,,
iht/scio-scala-beam-summit,[],Scala,1147feca-5437-5448-94ea-44b23a464e8e,This repository contains the template and the solution for the Beam Summit 2021 workshop,https://github.com/iht/scio-scala-beam-summit,readme,0,,
Bycelium/PyFlow,[],Python,665b5b47-3c1d-5e9f-97c9-cc9fcfd613c1,An open-source tool for visual and modular block programming in python,https://github.com/Bycelium/PyFlow,readme,0,,
uid4oe/grpc-web-demo,"['go', 'grpc', 'grpc-go', 'grpc-web', 'microservices', 'streaming']",Go,9c1f0114-1321-5113-8ed7-4ed7fc4870fd,Dockerized Go microservices and their envoy proxies for a flow which showcases  gRPC for Web Clients. Check the medium story!!!,https://github.com/uid4oe/grpc-web-demo,readme,0,,
fraunhoferportugal/tsfel,"['classification', 'colab-notebook', 'data-science', 'feature-engineering', 'feature-extraction', 'time-series']",Python,cd533f25-e093-5941-83e3-b3a6fe9de926,An intuitive library to extract features from time series.,https://github.com/fraunhoferportugal/tsfel,readme,0,,
matthewdeng/ray-train-demos,[],Jupyter Notebook,ecfe386c-0209-540a-9322-4eda6153739a,Demos using Ray Train,https://github.com/matthewdeng/ray-train-demos,,0,,
BrianPugh/cyclopts,"['argument-parser', 'cli', 'python', 'shell', 'typehints']",Python,083de7b0-582e-5db4-b2fb-8d22ac97d6ca,"Intuitive, easy CLIs based on python type hints.",https://github.com/BrianPugh/cyclopts,readme,0,,
saddle/saddle,[],HTML,bb5bf563-ca32-5b4c-b1f9-a58398fbb60c,SADDLE: Scala Data Library,https://github.com/saddle/saddle,readme,0,,
scalanlp/breeze,[],Scala,e8964e4d-5382-5f58-a9ba-01a2890af2b5,Breeze is/was a numerical processing library for Scala.,https://github.com/scalanlp/breeze,readme,0,,
spotify/ratatool,"['avro', 'bigquery', 'parquet', 'protobuf', 'scala', 'scalacheck']",Scala,7d6c218a-30fe-5ccb-b0cc-85932c81314f,"A tool for data sampling, data generation, and data diffing",https://github.com/spotify/ratatool,readme,0,,
nevillelyh/scio-koans,"['algebird', 'data', 'scala', 'scio']",Scala,c4a6d50a-3cf3-5095-97ca-683efa9b0184,A collection of Scio exercises inspired by Ruby Koans and many others.,https://github.com/nevillelyh/scio-koans,readme,0,,
abhishekkrthakur/approachingalmost,[],,f53deddf-5596-52f1-9573-4ced1921bf5f,Approaching (Almost) Any Machine Learning Problem,https://github.com/abhishekkrthakur/approachingalmost,readme,0,,
falcopackages/falco-cli,"['build-in-public', 'cookiecutter', 'cookiecutter-template', 'django', 'hatch', 'htmx', 'starter-project']",Python,b871dc2a-34d0-5c95-8206-fddcd8a01913,Enhance your Django developer experience: CLI and Guides for the Modern Django Developer.,https://github.com/falcopackages/falco-cli,readme,0,,
tensorforce/tensorforce,"['control', 'deep-reinforcement-learning', 'reinforcement-learning', 'system-control', 'tensorflow', 'tensorflow-library', 'tensorforce']",Python,b8cf4c32-0839-5ba9-9f04-3911bb49e50d,Tensorforce: a TensorFlow library for applied reinforcement learning,https://github.com/tensorforce/tensorforce,readme,0,,
Zac-HD/hypofuzz,"['fuzzing', 'hypothesis', 'testing']",Python,c9b9361e-8953-5a0a-90dd-9943f08e65ce,Adaptive fuzzing of Hypothesis tests,https://github.com/Zac-HD/hypofuzz,readme,0,,
massquantity/DBRL,"['flink', 'offline', 'recommender-system', 'reinforcement-learning']",Python,cd1b3de9-4a5a-50f6-aad3-12ee4880ae23,Dataset Batch(offline) Reinforcement Learning for recommender system,https://github.com/massquantity/DBRL,readme,0,,
reczoo/FuxiCTR,"['ctr', 'ctr-prediction', 'cvr', 'pytorch', 'recommender-systems']",Python,82e03023-b885-5b83-90b7-b5f1e2dc31aa,"A configurable, tunable, and reproducible library for CTR prediction https://fuxictr.github.io",https://github.com/reczoo/FuxiCTR,readme,0,,
scalacenter/scala-advent-of-code,"['advent-of-code-2021', 'scala', 'scalacenter']",Scala,81b0e7b4-23fc-51c6-b39e-1344c33be873,Scala Center's solution of Advent of Code,https://github.com/scalacenter/scala-advent-of-code,readme,0,,
google-deepmind/concordia,"['agent-based-simulation', 'generative-agents', 'multi-agent', 'social-simulation']",Python,875af2e5-4a9b-5891-9d9d-bd153103526a,A library for generative social simulation,https://github.com/google-deepmind/concordia,readme,0,,
AakashKumarNain/TF_JAX_tutorials,"['deep-learning', 'jax', 'machine-learning', 'python', 'tensorflow', 'tutorials']",Jupyter Notebook,d45081d7-6f3c-5504-b93b-7d8b4f4b9d26,All about the fundamental blocks of TF and JAX!,https://github.com/AakashKumarNain/TF_JAX_tutorials,readme,0,,
stanfordnlp/GloVe,[],C,daee026e-7954-58f7-80fe-abcccb6d2e13,"Software in C and data files for the popular GloVe model for distributed word representations, a.k.a. word vectors or embeddings",https://github.com/stanfordnlp/GloVe,readme,0,,
pomponchik/cantok,"['cancellationtoken', 'threading', 'threading-synchronization']",Python,9258ff23-b49c-5264-972a-03470ab78e2c,"Implementation of the ""Cancellation Token"" pattern",https://github.com/pomponchik/cantok,readme,0,,
gitpod-io/gitpod,"['cde', 'cloud', 'cloud-development', 'cloud-development-environments', 'cloud-ide', 'code-review', 'dev-environment', 'developer-environment', 'developer-experience', 'disposable', 'editor', 'ephemeral', 'gitpod', 'ide', 'jetbrains', 'prebuilds', 'remote-development', 'remote-devtools', 'vscode']",TypeScript,a362877d-f059-58fb-b207-3a15169d6121,The developer platform for on-demand cloud development environments to create software faster and more securely.,https://github.com/gitpod-io/gitpod,readme,0,,
microsoft/python-sample-vscode-django-tutorial,[],Python,9faaf584-c9ce-5313-87a6-48a770a1d60a,Sample code for the Django tutorial in the VS Code documentation,https://github.com/microsoft/python-sample-vscode-django-tutorial,readme,0,,
automl/HpBandSter,"['automated-machine-learning', 'automl', 'bayesian-optimization', 'hyperparameter-optimization', 'neural-architecture-search']",Python,91e46dd8-e055-5b99-9bea-636be58f63de,a distributed Hyperband implementation on Steroids,https://github.com/automl/HpBandSter,readme,0,,
PRQL/prql,"['data', 'pipeline', 'sql']",Rust,e5dd9af2-be05-5cfe-8c05-f1dd5300fae5,"PRQL is a modern language for transforming data — a simple, powerful, pipelined SQL replacement",https://github.com/PRQL/prql,readme,0,,
dfm/tinygp,[],Python,43fe1c6e-8654-5baa-a0c3-197936218aeb,The tiniest of Gaussian Process libraries,https://github.com/dfm/tinygp,readme,0,,
libffcv/ffcv,"['data-science', 'machine-learning', 'pytorch']",Python,bff3ee29-8b7f-5769-b099-b2e0a1b4b2c3,FFCV: Fast Forward Computer Vision (and other ML workloads!),https://github.com/libffcv/ffcv,readme,0,,
MadryLab/datamodels-data,[],Python,290fa8bf-d552-5f1b-a34c-6d36c248cfde,"Data for ""Datamodels: Predicting Predictions with Training Data""",https://github.com/MadryLab/datamodels-data,readme,0,,
nevillelyh/scio-deep-dive,[],Scala,d0b404a0-6c33-581a-8fdf-31c8d9b45570,Building Scio from scratch step by step,https://github.com/nevillelyh/scio-deep-dive,readme,0,,
rixwew/pytorch-fm,"['autoint', 'avazu-dataset', 'collaborative-filtering', 'criteo-dataset', 'ctr-prediction', 'dcn', 'deepfm', 'factorization-machines', 'ffm', 'fm', 'fnfm', 'hofm', 'movielens-dataset', 'neural-collaborative-filtering', 'nfm', 'pnn', 'pytorch', 'xdeepfm']",Python,8e61c2d6-6a17-5d21-9ac4-cd62d7315103,Factorization Machine models in PyTorch,https://github.com/rixwew/pytorch-fm,readme,0,,
yezz123/ormdantic,"['async', 'asyncio', 'database', 'hacktoberfest', 'orm', 'postgres', 'pydantic', 'pypika', 'python', 'sql', 'sqlalchemy', 'sqlite', 'typing']",Python,81032806-9f1b-554d-8ca4-1098b79fe176,Asynchronous ORM that uses pydantic models to represent database tables ✨,https://github.com/yezz123/ormdantic,readme,0,,
nicolaskruchten/jupyter_pivottablejs,"['data-analysis', 'data-science', 'interactive', 'jupyter-notebook', 'pivot-chart', 'pivot-tables']",Python,ddded36e-3861-5ee2-bc7d-cc268f3badad,"Drag’n’drop Pivot Tables and Charts for Jupyter/IPython Notebook, care of PivotTable.js",https://github.com/nicolaskruchten/jupyter_pivottablejs,readme,0,,
mljar/mljar-examples,"['machine-learning', 'machine-learning-algorithms', 'machine-learning-api', 'machine-learning-library', 'neural-networks']",Jupyter Notebook,49bcd77f-533c-5c72-91f3-62ca28f0f092,Examples how MLJAR can be used,https://github.com/mljar/mljar-examples,readme,0,,
linkedin/venice,"['ai', 'database', 'hadoop', 'kafka', 'ml']",Java,df9cedb8-01db-576e-900c-ce3dbac0caa9,"Venice, Derived Data Platform for Planet-Scale Workloads.",https://github.com/linkedin/venice,readme,0,,
astronomer/astronomer-cosmos,"['airflow', 'airflow-operators', 'apache-airflow', 'dbt', 'python', 'workflow']",Python,1960cd8a-f527-55a5-a00c-5a2aa067becf,Run your dbt Core or dbt Fusion projects as Apache Airflow DAGs and Task Groups with a few lines of code,https://github.com/astronomer/astronomer-cosmos,readme,0,,
NVIDIA-Merlin/NVTabular,"['deep-learning', 'feature-engineering', 'feature-selection', 'gpu', 'machine-learning', 'nvidia', 'preprocessing', 'recommendation-system', 'recommender-system']",Python,ffa43e0f-adde-5bb4-b8a6-7a19ea9c6634,NVTabular is a feature engineering and preprocessing library for tabular data designed to quickly and easily manipulate terabyte scale datasets used to train deep learning based recommender systems.,https://github.com/NVIDIA-Merlin/NVTabular,readme,0,,
pytest-dev/pytest,"['hacktoberfest', 'python', 'test', 'testing', 'unit-testing']",Python,573767e0-214d-58b6-a2b1-9db55e7d4f7c,"The pytest framework makes it easy to write small tests, yet scales to support complex functional testing",https://github.com/pytest-dev/pytest,readme,0,,
googleapis/python-bigquery,[],Python,2c8dcd8d-cd54-5502-a7c0-428c6023027b,,https://github.com/googleapis/python-bigquery,readme,0,,
googleapis/python-api-core,[],,3c1c2549-eeca-5c3d-83c1-d877265a546a,This library has moved to https://github.com/googleapis/google-cloud-python/tree/main/packages/google-api-core,https://github.com/googleapis/python-api-core,readme,0,,
fossunited/joy,[],Jupyter Notebook,c5afc3fc-8acc-5b04-8713-856a8eabfb3e,Joy is a tiny creative coding library in Python.,https://github.com/fossunited/joy,readme,0,,
coax-dev/coax,"['reinforcement-learning', 'reinforcement-learning-agent', 'reinforcement-learning-algorithms']",Python,c9e63b2d-3de1-599c-a7d7-976937b9c4a8,Modular framework for Reinforcement Learning in python,https://github.com/coax-dev/coax,readme,0,,
8080labs/pyforest,[],Python,56ab1622-4a15-5a6b-b68b-87f2e2589ebe,pyforest - feel the bliss of automated imports,https://github.com/8080labs/pyforest,readme,0,,
huggingface/deep-rl-class,"['deep-learning', 'deep-reinforcement-learning', 'reinforcement-learning', 'reinforcement-learning-excercises']",MDX,036fd53e-ff28-545e-b42a-2faf9b2cb393,This repo contains the Hugging Face Deep Reinforcement Learning Course.,https://github.com/huggingface/deep-rl-class,readme,0,,
google/dopamine,"['ai', 'google', 'ml', 'rl', 'tensorflow']",Jupyter Notebook,11b658e2-71eb-5f76-9c73-0a5b613588d1,Dopamine is a research framework for fast prototyping of reinforcement learning algorithms.,https://github.com/google/dopamine,readme,0,,
quora/qmf,[],C++,199da183-c36c-5cf7-9319-8d0dafd100ac,A fast and scalable C++ library for implicit-feedback matrix factorization models,https://github.com/quora/qmf,readme,0,,
accel-brain/accel-brain-code,"['auto-encoder', 'automatic-summarization', 'combinatorial-optimization', 'deep-learning', 'deep-q-network', 'deep-reinforcement-learning', 'energy-based-model', 'generative-adversarial-network', 'lstm', 'multi-agent-reinforcement-learning', 'q-learning', 'quantum-annealing', 'quantum-monte-carlo', 'reinforcement-learning', 'restricted-boltzmann-machine', 'self-supervised-learning', 'semi-supervised-learning', 'simulated-annealing', 'transfer-learning']",Python,8ef5dfaf-97aa-5f9b-9acb-b3681b3762b5,"The purpose of this repository is to make prototypes as case study in the context of proof of concept(PoC) and research and development(R&D) that I have written in my website. The main research topics are Auto-Encoders in relation to the representation learning, the statistical machine learning for energy-based models, adversarial generation networks(GANs), Deep Reinforcement Learning such as Deep Q-Networks, semi-supervised learning, and neural network language model for natural language processing.",https://github.com/accel-brain/accel-brain-code,readme,0,,
liyinxiao/LambdaRankNN,[],Python,c48d2fb0-36ba-50f4-a9a2-5298841866d4,LambdaRank Neural Network model using Keras.,https://github.com/liyinxiao/LambdaRankNN,readme,0,,
facebookresearch/ConvNeXt-V2,[],Python,98927a96-329f-5184-afd0-a0e5183e0c7a,Code release for ConvNeXt V2 model,https://github.com/facebookresearch/ConvNeXt-V2,readme,0,,
microsoft/pyright,[],Python,6124b21a-7b6f-5a6c-a31c-58c0211d3bf5,Static Type Checker for Python,https://github.com/microsoft/pyright,readme,0,,
illustrated-machine-learning/illustrated-machine-learning.github.io,"['illustrated-machine-learning', 'illustrations', 'machine-learning', 'ml-illustrations']",JavaScript,da44c08c-6d8c-5532-b54b-1a7a7ccefd6a,Website containing illustrations about Machine Learning theory!,https://github.com/illustrated-machine-learning/illustrated-machine-learning.github.io,readme,0,,
frictionlessdata/frictionless-py,[],Python,4f0de90e-4176-5a5f-a795-c3ced055aee7,"Data management framework for Python that provides functionality to describe, extract, validate, and transform tabular data",https://github.com/frictionlessdata/frictionless-py,readme,0,,
amesar/mlflow-examples,[],Python,65e6a9f8-e9de-530e-97a7-eb0210053425,Basic and advanced MLflow examples for many ML flavors,https://github.com/amesar/mlflow-examples,readme,0,,
datarobot/datarobot-user-models,['dr-engineering'],Java,1abfb198-cb56-5fab-a6cd-a784bb7e1308,User's custom models boilerplate,https://github.com/datarobot/datarobot-user-models,readme,0,,
mljar/mljar-supervised,"['automated-machine-learning', 'automl', 'automl-api', 'automl-python', 'catboost', 'data-science', 'decision-tree', 'ensemble', 'feature-engineering', 'hyper-parameters', 'hyperparameter-optimization', 'lightgbm', 'machine-learning', 'mljar', 'neural-network', 'random-forest', 'scikit-learn', 'xgboost']",Python,b588f97a-446b-5ffd-a8d9-4beb463a1054,"Python package for AutoML on Tabular Data with Feature Engineering, Hyper-Parameters Tuning, Explanations and Automatic Documentation",https://github.com/mljar/mljar-supervised,readme,0,,
zenml-io/zenml-gitflow,[],Python,f7ef8b5b-7464-5723-b34b-89ef28e6f8b3,A repository that showcases how you can use ZenML with Git,https://github.com/zenml-io/zenml-gitflow,readme,0,,
openai/openai-cookbook,"['chatgpt', 'gpt-4', 'openai', 'openai-api']",Jupyter Notebook,dbb80425-e4c8-5869-9aad-56b9272037d6,Examples and guides for using the OpenAI API,https://github.com/openai/openai-cookbook,readme,0,,
karpathy/nanoGPT,[],Python,28929743-9bfc-5adf-81de-8fe4d0cef001,"The simplest, fastest repository for training/finetuning medium-sized GPTs.",https://github.com/karpathy/nanoGPT,readme,0,,
probml/dynamax,"['hidden-markov-models', 'jax', 'kalman-filter', 'python', 'state-space-models']",Python,d6548d1c-1ecc-5b1f-bc66-33183ce92f5f,A Python package for probabilistic state space modeling with JAX,https://github.com/probml/dynamax,readme,0,,
wiringbits/scala-webapp-template,"['hacktoberfest', 'postgresql', 'react', 'scala', 'scalajs', 'webapp']",Scala,5a04e600-5bc7-5ce3-aaf9-9a3b413a3831,"A pragmatic skeleton to build web applications in Scala/Scala.js, including user registration, login, admin portal, and, deployments",https://github.com/wiringbits/scala-webapp-template,readme,0,,
google-research/tuning_playbook,[],,22e0eed2-34eb-5e6a-9a93-f1fef4d53a76,A playbook for systematically maximizing the performance of deep learning models.,https://github.com/google-research/tuning_playbook,readme,0,,
approximatelabs/sketch,"['ai', 'codex', 'copilot', 'data', 'data-science', 'dataframe', 'datasketch', 'datasketches', 'df', 'ds', 'gpt3', 'lambdaprompt', 'pandas', 'python', 'sketches', 'tabular-data']",Python,578b96a6-3498-563c-9a75-71a7ed9d95e7,AI code-writing assistant that understands data content,https://github.com/approximatelabs/sketch,readme,0,,
NVIDIA-Merlin/HugeCTR,"['cpp', 'deep-learning', 'gpu-acceleration', 'recommendation-system', 'recommender-system']",C++,4668ff0c-9507-5073-bda7-430cfd898828,HugeCTR is a high efficiency GPU framework designed for Click-Through-Rate (CTR) estimating training,https://github.com/NVIDIA-Merlin/HugeCTR,readme,0,,
facebookresearch/dino,[],Python,991e8d97-4637-5b45-8e0e-4ba6d630dc1c,PyTorch code for Vision Transformers training with the Self-Supervised learning method DINO,https://github.com/facebookresearch/dino,readme,0,,
sinaptik-ai/pandas-ai,"['ai', 'csv', 'data', 'data-analysis', 'data-science', 'data-visualization', 'database', 'datalake', 'gpt-4', 'llm', 'pandas', 'sql', 'text-to-sql']",Python,5bde34c3-20c1-5447-ab9f-f66eb6abdfd4,"Chat with your database or your datalake (SQL, CSV, parquet). PandasAI makes data analysis conversational using LLMs and RAG.",https://github.com/sinaptik-ai/pandas-ai,readme,0,,
eclipse-vertx/vert.x,"['concurrency', 'event-loop', 'high-performance', 'http2', 'java', 'jvm', 'netty', 'nio', 'non-blocking', 'reactive', 'vertx']",Java,e558c05d-4e89-5326-a8c1-edd97ec1db18,Vert.x is a tool-kit for building reactive applications on the JVM,https://github.com/eclipse-vertx/vert.x,readme,0,,
asweigart/pyperclip,[],Python,74cbc53e-18a5-59a0-9ea0-84ede1ee58dd,Python module for cross-platform clipboard functions.,https://github.com/asweigart/pyperclip,readme,0,,
alibaba/EasyNLP,"['bert', 'deep-learning', 'fewshot-learning', 'knowledge-distillation', 'knowledge-pretraining', 'machine-learning', 'nlp', 'pretrained-models', 'pytorch', 'text-classification', 'text-image-retrieval', 'text-to-image-synthesis', 'transfer-learning', 'transformers']",Python,a474456c-7502-5bfe-93e4-c78b5032238e,EasyNLP: A Comprehensive and Easy-to-use NLP Toolkit,https://github.com/alibaba/EasyNLP,readme,0,,
