repo,topics,language,id,description,url,doc_source,score,is_a_curated_list,is_not_a_library
jnv/lists,"['awesome', 'awesome-list', 'curated-lists', 'lists', 'resources']",,6a6a505a-45ec-5402-b338-aea20a0047fd,The definitive list of lists (of lists) curated on GitHub and elsewhere,https://github.com/jnv/lists,readme,8.9308405,1,1
zudochkin/awesome-newsletters,"['awesome', 'awesome-list', 'email', 'email-newsletter', 'emails', 'newsletter']",,1dbd0153-427b-5c52-9793-faa45ae6877e,A list of amazing Newsletters,https://github.com/zudochkin/awesome-newsletters,readme,7.2354603,1,1
ddotta/awesome-polars,"['awesome', 'awesome-list', 'collection', 'curated-list', 'nodejs', 'polars', 'python', 'rstats', 'rust']",,62762741-11e6-5e42-9d12-8e8101f7469d,"A curated list of Polars talks, tools, examples & articles. Contributions welcome ! ",https://github.com/ddotta/awesome-polars,readme,7.233369,1,1
aporia-ai/mlops.toys,"['awesome', 'awesome-list', 'data-science', 'list', 'machine-learning', 'mlops']",Vue,9647593c-9b19-5b13-b2ef-744125cd6f1e,"🎲 A curated list of MLOps projects, tools and resources",https://github.com/aporia-ai/mlops.toys,readme,6.951973,1,1
awesomelistsio/awesome-reinforcement-learning,"['awesome', 'awesome-list', 'awesome-lists', 'reinforcement-learning']",Python,7636125b-0534-500b-b0b9-22717eeefb11,"A curated list of awesome frameworks, libraries, tools, environments, tutorials, research papers, and resources for reinforcement learning (RL). This list covers fundamental concepts, advanced algorithms, applications, and popular frameworks for building RL models.",https://github.com/awesomelistsio/awesome-reinforcement-learning,readme,6.8515506,1,1
wsvincent/awesome-django,"['awesome', 'awesome-list', 'django']",Python,e18afc19-c4d7-5fea-b056-72f20f33f4a3,A curated list of awesome things related to Django,https://github.com/wsvincent/awesome-django,readme,6.793023,1,1
pditommaso/awesome-pipeline,"['awesome-list', 'workflow']",,a4ebee38-74c6-5779-b331-0c15a5d58b9b,A curated list of awesome pipeline toolkits inspired by Awesome Sysadmin,https://github.com/pditommaso/awesome-pipeline,readme,6.7391953,1,1
mjhea0/awesome-fastapi,"['awesome', 'awesome-list', 'fastapi', 'starlette']",,c4fec4da-7b85-5540-aa31-346a58c8c424,A curated list of awesome things related to FastAPI,https://github.com/mjhea0/awesome-fastapi,readme,6.574901,1,1
shubhamgrg04/awesome-diagramming,"['awesome-list', 'diagram', 'uml']",,87f9338c-1ff5-5e64-93c4-24bcfd6ba711,A curated collection of diagramming tools used by leading software engineering teams,https://github.com/shubhamgrg04/awesome-diagramming,readme,6.5212126,1,1
wuchong/awesome-flink,"['awesome', 'awesome-flink', 'awesome-list', 'flink']",,4f86df74-8927-5d0d-8e2c-d050198c5d68,😎  A curated list of amazingly awesome Flink and Flink ecosystem resources,https://github.com/wuchong/awesome-flink,readme,6.47927,1,1
EthicalML/awesome-annual-reviews-and-trends,[],,22095ee8-aa17-5edf-8178-c1848c396ab5,"A curated list of awesome year-in-review and annual trends / predictions for 2022, 2023 and beyond 🚀",https://github.com/EthicalML/awesome-annual-reviews-and-trends,readme,6.2036304,1,1
fffaraz/awesome-cpp,"['awesome', 'awesome-list', 'c', 'c-plus-plus', 'cpp', 'cpp-library', 'cppcon', 'libraries', 'list', 'lists', 'programming-tutorial', 'resources']",,bf440b15-fb4d-5e6e-aac6-46124946c73c,"A curated list of awesome C++ (or C) frameworks, libraries, resources, and shiny things. Inspired by awesome-... stuff.",https://github.com/fffaraz/awesome-cpp,readme,6.1589413,1,1
ramitsurana/awesome-kubernetes,"['aws', 'azure', 'books', 'cloud-providers', 'deploy-kubernetes', 'docker', 'enterprise-kubernetes-products', 'google-cloud', 'google-kubernetes', 'kubernetes', 'kubernetes-cluster', 'kubernetes-sources', 'machine-learning', 'meetup', 'minikube', 'monitoring-kubernetes', 'resource', 'schedule']",Shell,f283f1aa-2254-5605-9630-80c59c07024b,A curated list for awesome kubernetes sources :ship::tada:,https://github.com/ramitsurana/awesome-kubernetes,readme,6.1360116,1,1
visenger/awesome-mlops,"['ai', 'data-science', 'devops', 'engineering', 'federated-learning', 'machine-learning', 'ml', 'mlops', 'software-engineering']",,102480a9-60d3-56ee-b142-3573a3b9c9a8,A curated list of references for MLOps,https://github.com/visenger/awesome-mlops,readme,6.003039,1,1
DovAmir/awesome-design-patterns,"['architecture', 'awesome', 'awesome-list', 'cloud-computing', 'design-patterns', 'gof-patterns', 'lists', 'microservices', 'resources']",,b5f0b508-114b-5d97-8c31-36b3b190a4da,A curated list of software and architecture related design patterns.,https://github.com/DovAmir/awesome-design-patterns,readme,5.9682255,1,1
mauhai/awesome-jupyterlab,"['awesome', 'collections', 'jupyterlab', 'jupyterlab-extension']",,5bab555b-9ee4-500e-8f8a-738d2247825b,A curated list of awesome JupyterLab extensions and resources,https://github.com/mauhai/awesome-jupyterlab,readme,5.89396,1,1
pabloem/awesome-beam,[],,42af1a59-3545-55cf-a2f8-6165e4edf4ec,A curated list of awesome resources for Apache Beam,https://github.com/pabloem/awesome-beam,readme,5.8343306,1,1
theanalyst/awesome-distributed-systems,"['architecture', 'consensus', 'distributed-systems', 'lamport', 'paper', 'paxos']",,551634f3-7fc6-5b31-a676-b693e59d648c,A curated list to learn about distributed systems,https://github.com/theanalyst/awesome-distributed-systems,readme,5.8047576,1,1
brianspiering/awesome-deep-rl,[],,bb89d0c8-db30-5379-9b8d-f4b0f5dd3a4f,A curated list of awesome Deep Reinforcement Learning resources,https://github.com/brianspiering/awesome-deep-rl,readme,5.7332687,1,1
Palashio/awesome-libra,[],,8ca301dc-cd7d-5502-a5a8-4f9a88db7cad,A curated list of all things related to libra.,https://github.com/Palashio/awesome-libra,readme,5.604686,1,1
costezki/awesome-nlprojects,"['awersome-list', 'machine-learning', 'natural-language-processing', 'nlp']",,4060f165-6902-53bc-8e6d-60217fda3ea2,List of projects related to Natural Language Processing (NLP) that make a geek smile for they exist,https://github.com/costezki/awesome-nlprojects,readme,5.597083,1,1
kengz/awesome-deep-rl,"['awesome-list', 'deep-reinforcement-learning', 'deep-rl', 'reinforcement-learning', 'resources']",,4a61394a-9995-50eb-a77a-dacd5490ed31,A curated list of awesome Deep Reinforcement Learning resources.,https://github.com/kengz/awesome-deep-rl,readme,5.4608173,1,1
travisvn/awesome-claude-skills,"['agentic-coding', 'anthropic', 'awesome', 'awesome-list', 'awesome-lists', 'claude', 'claude-ai', 'claude-code', 'claude-desktop', 'claude-skills', 'claudeskills']",,7fddb7a8-8ca3-56f4-bdcc-9088fd1315f0,"A curated list of awesome Claude Skills, resources, and tools for customizing Claude AI workflows — particularly Claude Code",https://github.com/travisvn/awesome-claude-skills,readme,5.435575,1,1
youngwookim/awesome-hadoop,[],,7dbc56bf-b0c5-5b88-a171-3f676b61191a,A curated list of amazingly awesome Hadoop and Hadoop ecosystem resources,https://github.com/youngwookim/awesome-hadoop,readme,5.397048,1,1
pawl/awesome-etl,[],,e2abc867-298f-5ee6-bb47-4a200494aab7,"A curated list of awesome ETL frameworks, libraries, and software.",https://github.com/pawl/awesome-etl,readme,5.372819,1,1
creyesp/Awesome-recsys,"['awesome-list', 'deep-learning', 'machine-learning', 'papers', 'personalization', 'recommender-system', 'recsys']",,1dbbd6f0-01c6-54b0-bf6c-618f876ea524,Curated list of recommnedation system topics,https://github.com/creyesp/Awesome-recsys,readme,5.328973,1,1
r0f1/datascience,"['artificial-intelligence', 'awesome', 'awesome-list', 'bayes', 'data-analysis', 'data-mining', 'data-science', 'data-visualization', 'datascience', 'deep-learning', 'deeplearning', 'machine-learning', 'python', 'statistics']",,d1b21161-09d6-5843-85e9-a6a7aadce77f,Curated list of Python resources for data science.,https://github.com/r0f1/datascience,readme,5.218129,1,1
josephmisiti/awesome-machine-learning,[],Python,f51eac8f-0fcc-5db4-ac5e-d6dfdeb617ca,"A curated list of awesome Machine Learning frameworks, libraries and software.",https://github.com/josephmisiti/awesome-machine-learning,readme,5.2119913,1,1
n2cholas/awesome-jax,"['autograd', 'awesome', 'awesome-list', 'deep-learning', 'jax', 'machine-learning', 'neural-network', 'numpy', 'xla']",,3691b379-d8b0-53b9-9375-a95dfb68a5ad,JAX - A curated list of resources https://github.com/google/jax,https://github.com/n2cholas/awesome-jax,readme,5.104913,1,1
madd86/awesome-system-design,"['distributed-systems', 'hadoop-ecosystem', 'interview', 'message-broker', 'microservices', 'microservices-architecture', 'nosql', 'relational-database', 'stream-processing']",,c8a559e9-1498-55f9-b384-487209381fba,A curated list of awesome System Design (A.K.A. Distributed Systems) resources.,https://github.com/madd86/awesome-system-design,readme,5.099374,1,1
MarcSkovMadsen/awesome-streamlit,"['analytics', 'apps', 'awesome-list', 'data', 'data-science', 'exploration', 'finance', 'fun', 'innovation', 'machine-learning', 'mathematics', 'models', 'python', 'streamlit', 'trading']",HTML,9369c17d-24eb-5696-a2a6-f992e65cb2bb,The purpose of this project is to share knowledge on how awesome Streamlit is and can be,https://github.com/MarcSkovMadsen/awesome-streamlit,readme,5.0820456,1,1
awesomedata/awesome-public-datasets,"['aaron-swartz', 'awesome-public-datasets', 'datasets', 'opendata']",,4ebf2d93-5068-5668-bf76-530789fa6366,A topic-centric list of HQ open datasets.,https://github.com/awesomedata/awesome-public-datasets,readme,4.948167,1,1
kilimchoi/engineering-blogs,"['engineering-blogs', 'lists', 'programming-blogs', 'software-development', 'tech']",Ruby,c01c77d4-6cca-5a5c-91a8-e4a579cbfbbe,A curated list of engineering blogs,https://github.com/kilimchoi/engineering-blogs,readme,4.9256086,1,1
sickn33/antigravity-awesome-skills,"['agentic-skills', 'ai-agents', 'antigravity', 'autonomous-coding', 'claude-code', 'mcp', 'react-patterns', 'security-auditing']",Python,93032f3d-079a-5cb4-bbe7-c25e58755229,"The Ultimate Collection of 900+ Agentic Skills for Claude Code/Antigravity/Cursor. Battle-tested, high-performance skills for AI agents including official skills from Anthropic and Vercel.",https://github.com/sickn33/antigravity-awesome-skills,readme,4.8605247,1,1
ai-boost/awesome-prompts,"['awesome', 'awesome-list', 'chatgpt', 'gpt4', 'gpts', 'gptstore', 'papers', 'prompt', 'prompt-engineering']",,256a85ca-e07b-58e5-ac35-91db7fc7465f,"Curated list of chatgpt prompts from the top-rated GPTs in the GPTs Store. Prompt Engineering, prompt attack & prompt protect. Advanced Prompt Engineering papers.",https://github.com/ai-boost/awesome-prompts,readme,4.817416,1,1
hemansnation/deep-learning-project-ideas,[],,1d81f81c-e006-5b24-858c-b705b3148256,"Curated list of Machine Learning, NLP, Vision, Recommender Systems Project Ideas",https://github.com/hemansnation/deep-learning-project-ideas,readme,4.8063574,1,1
NirantK/awesome-project-ideas,"['awesome', 'awesome-list', 'classification', 'dataset', 'deep-learning', 'forecasting', 'image-classification', 'machine-learning', 'multi-label-classification', 'series-forecasting']",,c64ddcff-35f6-5f3e-b957-23481ef7153c,"Curated list of Machine Learning, NLP, Vision, Recommender Systems Project Ideas",https://github.com/NirantK/awesome-project-ideas,readme,4.761151,1,1
bradtraversy/design-resources-for-developers,[],,311bc521-1660-527c-9bce-8ce56dd740b1,"Curated list of design and UI resources from stock photos, web templates, CSS frameworks, UI libraries, tools and much more",https://github.com/bradtraversy/design-resources-for-developers,readme,4.6366453,1,1
azminewasi/Curated-Reinforcement-Learning-Resources,"['deep-learning', 'deep-reinforcement-learning', 'neural-network', 'reinforcement', 'reinforcement-learning', 'reinforcement-learning-agent', 'reinforcement-learning-algorithms', 'reinforcement-learning-environments', 'reinforcement-learning-excercises', 'reinforcement-learning-tutorials']",,93af64dd-5418-57bf-82fd-2ff283a554f4,"Reinforcement learning is a machine learning technique where agents learn to make optimal decisions by maximizing reward signals through interactions with environment. This repository provides a curated list of resources for learning reinforcement learning, including courses, & tutorials from various providers.",https://github.com/azminewasi/Curated-Reinforcement-Learning-Resources,readme,4.6028075,1,1
cloudcommunity/Free-Certifications,"['awesome', 'awesome-list', 'awesome-lists', 'certification', 'certifications', 'exams', 'free', 'free-certification', 'free-certifications', 'free-coupon', 'free-coupons', 'free-course', 'free-courses', 'free-learning', 'free-voucher', 'free-vouchers', 'freebie', 'freebies', 'hacktoberfest', 'learning']",,5f8d0d08-bd20-5cf8-bf9b-fd92ec1d114e,A curated list of free courses with certifications. Also available at https://free-certifications.com/,https://github.com/cloudcommunity/Free-Certifications,readme,4.581464,1,1
Renumics/awesome-open-data-centric-ai,"['active-learning', 'awesome-list', 'bias-detection', 'computer-vision', 'data-centric-ai', 'data-curation', 'data-drift', 'data-versioning', 'data-visualization', 'deep-learning', 'documentation-only', 'explainable-ai', 'feature-vector', 'machine-learning', 'nlp', 'noisy-labels', 'outlier-detection', 'robust-machine-learning', 'synthetic-data', 'uncertainty-estimation']",,6ee58ab7-a21a-5804-8fe0-2580eda75758,Curated list of open source tooling for data-centric AI on unstructured data.,https://github.com/Renumics/awesome-open-data-centric-ai,readme,4.5420356,1,1
f/prompts.chat,"['ai', 'artificial-intelligence', 'awesome-list', 'chatgpt', 'chatgpt-prompts', 'claude', 'gemini', 'gpt', 'gpt-4', 'llm', 'machine-learning', 'nextjs', 'open-source', 'openai', 'prompt-engineering', 'prompts', 'prompts-chat', 'typescript']",HTML,1f324fdc-5690-5d3e-9ba1-0201ec59fdbb,"f.k.a. Awesome ChatGPT Prompts. Share, discover, and collect prompts from the community. Free and open source — self-host for your organization with complete privacy.",https://github.com/f/prompts.chat,readme,4.433145,1,1
ronikobrosly/awesome-data-leadership,[],,7618ee28-b57f-59c0-b874-20bd20063acc,"A curated list of awesome posts, videos, and articles on leading a data team (small and large)",https://github.com/ronikobrosly/awesome-data-leadership,readme,4.4239187,1,1
lauris/awesome-scala,"['awesome', 'awesome-list', 'scala', 'scala-library', 'scalajs']",Python,c627ee35-96f4-5493-b366-d96e89f8b62c,"A community driven list of useful Scala libraries, frameworks and software.",https://github.com/lauris/awesome-scala,readme,4.361296,1,1
lukasmasuch/best-of-ml-python,"['automl', 'chatgpt', 'data-analysis', 'data-science', 'data-visualization', 'data-visualizations', 'deep-learning', 'gpt', 'gpt-3', 'jax', 'keras', 'machine-learning', 'ml', 'nlp', 'python', 'pytorch', 'scikit-learn', 'tensorflow', 'transformer']",,88532728-a0cd-5d5f-8e54-68a9ab4a57b3,🏆 A ranked list of awesome machine learning Python libraries. Updated weekly.,https://github.com/lukasmasuch/best-of-ml-python,readme,4.3423553,1,1
ml-tooling/best-of-web-python,"['api', 'awesome', 'best-of', 'best-of-list', 'django', 'django-rest-framework', 'fastapi', 'flask', 'flask-restful', 'framework', 'graphql', 'html', 'http', 'library', 'openapi', 'pyramid', 'python', 'rest-api', 'serverless', 'web-development']",,eea984e4-6c67-5330-91bf-f822aaa66ccb,🏆  A ranked list of awesome python libraries for web development. Updated weekly.,https://github.com/ml-tooling/best-of-web-python,readme,4.335706,1,1
EthicalML/awesome-production-machine-learning,"['awesome', 'awesome-list', 'data-mining', 'deep-learning', 'explainability', 'interpretability', 'large-scale-machine-learning', 'large-scale-ml', 'machine-learning', 'machine-learning-operations', 'ml-operations', 'ml-ops', 'mlops', 'privacy-preserving', 'privacy-preserving-machine-learning', 'privacy-preserving-ml', 'production-machine-learning', 'production-ml', 'responsible-ai']",,6fab82d3-9587-585f-9843-a04f0563079c,"A curated list of awesome open source libraries to deploy, monitor, version and scale your machine learning",https://github.com/EthicalML/awesome-production-machine-learning,readme,4.3282003,1,1
jihoo-kim/awesome-RecSys,[],,bc96cfad-0378-51f9-824a-1caadcd9c0f2,"A curated list of awesome Recommender System (Books, Conferences, Researchers, Papers, Github Repositories, Useful Sites, Youtube Videos)",https://github.com/jihoo-kim/awesome-RecSys,readme,4.274755,1,1
ashishps1/awesome-leetcode-resources,"['algorithms', 'coding', 'data-structures', 'dsa', 'leetcode', 'leetcode-patterns']",Java,ef38b20e-75e9-5fc3-b3a9-29e8aa43e489,Awesome LeetCode resources to learn Data Structures and Algorithms and prepare for Coding Interviews.,https://github.com/ashishps1/awesome-leetcode-resources,readme,4.1985173,1,1
online-ml/awesome-online-machine-learning,"['awesome', 'awesome-list', 'machine-learning', 'online-machine-learning']",,c9cd2396-19b4-5049-8fde-1a44cb819c3a,:bookmark_tabs: Online machine learning resources,https://github.com/online-ml/awesome-online-machine-learning,readme,4.1936593,1,1
Gear61/Tech-Career-Growth-Learning-Resources-And-Roadmaps,[],,f2dceb52-c522-5393-bb1f-9f099d42a955,"A curated, high-quality list of resources to learn any pillar of tech you want",https://github.com/Gear61/Tech-Career-Growth-Learning-Resources-And-Roadmaps,readme,4.151118,1,1
aikorea/awesome-rl,[],,a29663e6-963e-5282-8c9d-24f6e4dba82a,Reinforcement learning resources curated,https://github.com/aikorea/awesome-rl,readme,4.1355343,1,1
luspr/awesome-ml-courses,"['ai-courses', 'artificial-intelligence', 'deep-learning', 'machine-learning', 'reinforcement-learning']",,94dac6ef-e213-59f6-ba16-de5b0b284924,Awesome free machine learning and AI courses with video lectures.,https://github.com/luspr/awesome-ml-courses,readme,4.0393925,1,1
mattharrison/Tiny-Python-3.6-Notebook,[],,3ecc67bd-75c1-565e-a61f-b962b1792f46,This repository contains the text for the Tiny Python 3.6 Notebook.,https://github.com/mattharrison/Tiny-Python-3.6-Notebook,readme,4.0364885,0,1
ossu/computer-science,"['awesome-list', 'computer-science', 'courses', 'curriculum']",HTML,3ad6e195-485a-5744-a2b2-13a6b40bce03,🎓 Path to a free self-taught education in Computer Science!,https://github.com/ossu/computer-science,readme,3.9467027,1,1
ieshreya/Data-Science-Resources,"['computer-science', 'data-science', 'python', 'resources']",,f15b71c3-ddc5-57fc-9e8e-a1a1694c4cdd,"A curated collection of resources for learning Data Science. Covers Python, SQL, Statistics, ML, and real-world project guides.",https://github.com/ieshreya/Data-Science-Resources,readme,3.9150424,1,1
google-ai-edge/mediapipe,"['android', 'audio-processing', 'c-plus-plus', 'calculator', 'computer-vision', 'deep-learning', 'framework', 'graph-based', 'graph-framework', 'inference', 'machine-learning', 'mediapipe', 'mobile-development', 'perception', 'pipeline-framework', 'stream-processing', 'video-processing']",C++,cf9d7b80-2462-5f4b-97aa-aafaf1fb7978,"Cross-platform, customizable ML solutions for live and streaming media.",https://github.com/google-ai-edge/mediapipe,readme,3.895875,0,0
practical-tutorials/project-based-learning,"['beginner-project', 'cpp', 'golang', 'javascript', 'project', 'python', 'tutorial', 'webdevelopment']",,2515bf02-c8c9-5ac6-bfcc-a3e0e71243ea,Curated list of project-based tutorials,https://github.com/practical-tutorials/project-based-learning,readme,3.7877183,1,1
yangshun/tech-interview-handbook,"['algorithm', 'algorithm-interview', 'algorithm-interview-questions', 'algorithms', 'behavioral-interviews', 'coding-interviews', 'interview-practice', 'interview-preparation', 'interview-questions', 'system-design']",TypeScript,0044d05a-82a2-5871-afac-93f59c2a2956,Curated coding interview preparation materials for busy software engineers,https://github.com/yangshun/tech-interview-handbook,readme,3.786222,1,1
argoproj/argo-workflows,"['airflow', 'argo', 'argo-workflows', 'batch-processing', 'cloud-native', 'cncf', 'dag', 'data-engineering', 'gitops', 'hacktoberfest', 'k8s', 'knative', 'kubernetes', 'machine-learning', 'mlops', 'pipelines', 'workflow', 'workflow-engine']",Go,57b11bb5-de1d-571d-bc5e-7388e7164ba4,Workflow Engine for Kubernetes,https://github.com/argoproj/argo-workflows,readme,3.780822,0,0
SylphAI-Inc/LLM-engineer-handbook,[],,9f1e40b6-cea9-5adc-8f7c-6fa075da171f,"A curated list of Large Language Model resources, covering model training, serving, fine-tuning, and building LLM applications.",https://github.com/SylphAI-Inc/LLM-engineer-handbook,readme,3.7803526,1,1
EbookFoundation/free-programming-books,"['books', 'education', 'hacktoberfest', 'list', 'resource']",Python,42ded3bc-78b5-59f0-ab2d-6d89a6327514,:books: Freely available programming books,https://github.com/EbookFoundation/free-programming-books,readme,3.776584,1,1
faridrashidi/kaggle-solutions,"['awesome', 'competition', 'data-mining', 'data-science', 'kaggle', 'machine-learning', 'solutions']",HTML,77913f3c-f6fe-58a4-8343-8e2965b354cf,🏅 Collection of Kaggle Solutions and Ideas 🏅,https://github.com/faridrashidi/kaggle-solutions,readme,3.7660131,0,1
vinta/awesome-python,"['awesome', 'collections', 'python', 'python-framework', 'python-library', 'python-resources']",Python,5ca2eefe-c9d3-52a2-9707-be82b04f31f2,"An opinionated list of awesome Python frameworks, libraries, software and resources.",https://github.com/vinta/awesome-python,readme,3.722586,1,1
e2b-dev/awesome-ai-agents,"['agent', 'ai', 'artificial-intelligence', 'autogpt', 'autonomous-agents', 'awesome', 'babyagi', 'copilot', 'gpt', 'gpt-4', 'gpt-engineer', 'openai', 'python']",,842d61df-225c-5535-abf3-b30ca2083fa7,A list of AI autonomous agents,https://github.com/e2b-dev/awesome-ai-agents,readme,3.5850344,1,1
TsinghuaC3I/Awesome-RL-for-LRMs,"['awesome-list', 'deepseek-r1', 'llm', 'lrm', 'open-source', 'reasoning', 'rl']",TeX,86032f91-6cb3-54ba-85cd-35980dee5250,A Survey of Reinforcement Learning for Large Reasoning Models,https://github.com/TsinghuaC3I/Awesome-RL-for-LRMs,readme,3.575561,1,1
youssefHosni/Data-Science-Interview-Questions-Answers,"['data-science', 'deep-learning', 'interview-questions', 'machine-learning', 'python']",,b4064311-8cad-57d6-a1f7-67f018512aab,Curated list of data science interview questions and answers,https://github.com/youssefHosni/Data-Science-Interview-Questions-Answers,readme,3.466681,1,1
codecrafters-io/build-your-own-x,"['awesome-list', 'free', 'programming', 'tutorial-code', 'tutorial-exercises', 'tutorials']",Markdown,a5238baf-54f5-5e58-9614-6b1ab9833fe3,Master programming by recreating your favorite technologies from scratch.,https://github.com/codecrafters-io/build-your-own-x,readme,3.4149904,1,1
ugurkanates/awesome-real-world-rl,"['awesome', 'awesome-list', 'gans', 'imitation-learning', 'meta-learning', 'reinforcement-learning', 'robotics', 'sim2real', 'simulation']",,0a4d0333-f70c-5fb5-9ffc-870b6d7deab3,"Great resources for making Reinforcement Learning work in Real Life situations. Papers,projects and more. ",https://github.com/ugurkanates/awesome-real-world-rl,readme,3.4133239,1,1
Engineer1999/A-Curated-List-of-ML-System-Design-Case-Studies,[],,3b441a31-8b40-5e98-b51b-9d3a374570a1,"This repository contains a curated collection of 300+ case studies from over 80 companies, detailing practical applications and insights into machine learning (ML) system design. The contents are organized to help you easily find relevant case studies based on industry or specific ML use cases. ",https://github.com/Engineer1999/A-Curated-List-of-ML-System-Design-Case-Studies,readme,3.4073968,1,1
OrkoHunter/python-easter-eggs,"['easter-egg', 'python']",,acc8f91d-bb82-5fbc-8354-176c040a4658,Curated list of all the easter eggs and hidden jokes in Python,https://github.com/OrkoHunter/python-easter-eggs,readme,3.3814983,1,1
bmorelli25/Become-A-Full-Stack-Web-Developer,[],,39135dff-5858-5b4a-bc85-5d732ecf059e,Free resources for learning Full Stack Web Development,https://github.com/bmorelli25/Become-A-Full-Stack-Web-Developer,readme,3.2222297,1,1
Renumics/awesome-anything2vec,['documentation-only'],,3844ced6-9f2e-5836-880a-6609ab4c2662,Easy-to-use self-supervised representation learning for industrial AI,https://github.com/Renumics/awesome-anything2vec,readme,3.055808,1,1
err0r500/foundational-knowledge-for-programmers,"['algorithms', 'algorithms-and-data-structures', 'awesome', 'awesome-list', 'category-theory', 'computer-architecture', 'computer-science', 'cryptography', 'linear-algebra', 'networking', 'programming-languages', 'programming-paradigms', 'proof-theory', 'software-architecture', 'type-theory']",,38168b59-3a20-5146-9342-39ec2bdf0e6f,List of resources about foundational knowledge for programmers (supposed to last a few decades),https://github.com/err0r500/foundational-knowledge-for-programmers,readme,3.0455413,1,1
academic/awesome-datascience,"['analytics', 'awesome-list', 'data-mining', 'data-science', 'data-scientists', 'data-visualization', 'deep-learning', 'hacktoberfest', 'machine-learning', 'science']",,7d7396ba-d332-50dc-96bb-0f3b68f3baaf,:memo: An awesome Data Science repository to learn and apply for real world problems.,https://github.com/academic/awesome-datascience,readme,2.992023,1,1
cmhungsteve/Awesome-Transformer-Attention,"['attention-mechanism', 'attention-mechanisms', 'awesome-list', 'computer-vision', 'deep-learning', 'detr', 'papers', 'self-attention', 'transformer', 'transformer-architecture', 'transformer-awesome', 'transformer-cv', 'transformer-models', 'transformer-with-cv', 'transformers', 'vision-transformer', 'visual-transformer', 'vit']",,4eea0a1d-a518-519f-83f7-10d12fcf438e,"An ultimately comprehensive paper list of Vision Transformer/Attention, including papers, codes, and related websites",https://github.com/cmhungsteve/Awesome-Transformer-Attention,readme,2.9867654,1,1
