repo,topics,language,id,description,url,doc_source,score,is_a_curated_list,is_not_a_library
Netflix/eureka,[],Java,e8e71b7a-545b-58e6-af68-81fbca66356f,AWS Service registry for resilient mid-tier load balancing and failover.,https://github.com/Netflix/eureka,readme,0,,
st-tech/zr-obp,"['contextual-bandits', 'datasets', 'multi-armed-bandits', 'off-policy-evaluation', 'research']",Python,053b6938-cd4e-54ae-b82e-08fd9201f5ea,Open Bandit Pipeline: a python library for bandit algorithms and off-policy evaluation,https://github.com/st-tech/zr-obp,readme,0,,
Project-MONAI/MONAI,"['deep-learning', 'healthcare-imaging', 'medical-image-computing', 'medical-image-processing', 'monai', 'python3', 'pytorch']",Python,bdaf7e66-42a7-57f0-b211-f6b3c07902c3,AI Toolkit for Healthcare Imaging,https://github.com/Project-MONAI/MONAI,readme,0,,
tmc/langchaingo,"['ai', 'go', 'golang', 'langchain']",Go,a895ff83-53b9-5b96-8b16-4c6dbbbde818,"LangChain for Go, the easiest way to write LLM-based programs in Go",https://github.com/tmc/langchaingo,readme,0,,
rakyll/hey,[],Go,e2ed6a0a-8faf-50e2-b77e-ca485703f42a,"HTTP load generator, ApacheBench (ab) replacement",https://github.com/rakyll/hey,readme,0,,
replicate/cog,"['ai', 'containers', 'cuda', 'docker', 'machine-learning', 'pytorch', 'tensorflow']",Go,97073150-a9a8-5e28-8f30-e14e9f259e9a,Containers for machine learning,https://github.com/replicate/cog,readme,0,,
SkafteNicki/dtu_mlops,[],Python,59ee79ec-3c75-57c0-9414-3049cb984329,Exercises and supplementary material for the machine learning operations course at DTU.,https://github.com/SkafteNicki/dtu_mlops,readme,0,,
tensorflow/recommenders,"['recommender', 'recommender-system', 'tensorflow', 'tensorflow-recommenders']",Python,2ff5918e-a8e3-5ab9-b3bd-d7ab11ddeb0d,TensorFlow Recommenders is a library for building recommender system models using TensorFlow.,https://github.com/tensorflow/recommenders,readme,0,,
twitter-research/tgn,[],Python,e3e49d40-6952-50c3-99cf-67a0535b4f65,TGN: Temporal Graph Networks,https://github.com/twitter-research/tgn,readme,0,,
sgl-project/sglang,"['attention', 'blackwell', 'cuda', 'deepseek', 'diffusion', 'glm', 'gpt-oss', 'inference', 'llama', 'llm', 'minimax', 'moe', 'qwen', 'qwen-image', 'reinforcement-learning', 'transformer', 'vlm', 'wan']",Python,7ab98c39-d197-50fc-a4a6-efe53a4a4400,SGLang is a high-performance serving framework for large language models and multimodal models.,https://github.com/sgl-project/sglang,readme,0,,
facebookresearch/playtorch,[],MDX,a8d4d6e1-44e5-5958-84b5-3fc44b31a441,PlayTorch is a framework for rapidly creating mobile AI experiences.,https://github.com/facebookresearch/playtorch,readme,0,,
pytorch/serve,"['cpu', 'deep-learning', 'docker', 'gpu', 'kubernetes', 'machine-learning', 'metrics', 'mlops', 'optimization', 'pytorch', 'serving']",Java,6f975e87-aba1-5da0-95dd-83ab48bd7f9d,"Serve, optimize and scale PyTorch models in production",https://github.com/pytorch/serve,readme,0,,
TheKevJames/coveralls-python,"['coverage', 'coveralls', 'nosetests', 'pytest', 'python']",Python,c1929c9c-a62a-5e02-b307-2b244b5c0bd4,Show coverage stats online via coveralls.io,https://github.com/TheKevJames/coveralls-python,readme,0,,
pytest-dev/pytest-django,"['django', 'pytest', 'pytest-plugin', 'python', 'python3']",Python,350d004c-6f56-5d45-a710-45032056ba46,A Django plugin for pytest.,https://github.com/pytest-dev/pytest-django,readme,0,,
mewwts/addict,"['addict', 'dict', 'dictionaries', 'python', 'python-dict', 'recurse']",Python,5162b40d-e45a-58b2-95d1-6abf57de2bfa,The Python Dict that's better than heroin.,https://github.com/mewwts/addict,readme,0,,
GoogleCloudPlatform/serverless-spark-workshop,"['apache-spark', 'autoscaling', 'bigdata', 'dataproc', 'hadoop', 'serverless', 'solution-accelerator', 'spark', 'usecases']",Python,e734eef1-656d-5f3c-af28-423c8a4676a2,"Solution Accelerators for Serverless Spark on GCP, the industry's first auto-scaling and serverless Spark as a service",https://github.com/GoogleCloudPlatform/serverless-spark-workshop,readme,0,,
hpcaitech/ColossalAI,"['ai', 'big-model', 'data-parallelism', 'deep-learning', 'distributed-computing', 'foundation-models', 'heterogeneous-training', 'hpc', 'inference', 'large-scale', 'model-parallelism', 'pipeline-parallelism']",Python,fb8537e3-85e3-5b0c-97db-1b2c23f595c8,"Making large AI models cheaper, faster and more accessible",https://github.com/hpcaitech/ColossalAI,readme,0,,
mherrmann/helium,"['chrome', 'firefox', 'helium', 'python', 'python3', 'selenium', 'selenium-python', 'web-automation', 'web-scraping', 'webdriver']",Python,3c3b9ee2-7637-5e51-93d2-1ba41516beb7,Lighter web automation with Python,https://github.com/mherrmann/helium,readme,0,,
mindsdb/mindsdb,"['agents', 'ai', 'analytics', 'artificial-inteligence', 'bigquery', 'business-intelligence', 'databases', 'hacktoberfest', 'llms', 'mcp', 'mssql', 'mysql', 'postgresql', 'rag']",Python,54285aa5-d58b-5405-880d-6d0e992a042f,Query Engine for AI Analytics: Build self-reasoning agents across all your live data,https://github.com/mindsdb/mindsdb,readme,0,,
ivy-llc/ivy,"['jax', 'numpy', 'python', 'pytorch', 'tensorflow']",Python,21a83d18-08bd-5976-b061-a06816e2f85f,Convert Machine Learning Code Between Frameworks,https://github.com/ivy-llc/ivy,readme,0,,
borisdayma/dalle-mini,[],Python,be15fa80-6f4c-5ee1-940f-eb1903b22808,DALL·E Mini - Generate images from a text prompt,https://github.com/borisdayma/dalle-mini,readme,0,,
almond-sh/almond,"['jupyter', 'jupyter-kernels', 'jupyter-notebook', 'repl', 'scala', 'spark', 'spark-sql']",Scala,89ec4dc8-53c0-5b88-98fa-97414588101d,A Scala kernel for Jupyter,https://github.com/almond-sh/almond,readme,0,,
alexarchambault/plotly-scala,[],Scala,1c457f0e-cb73-5b2f-9fea-ba53ba6438d2,Scala bindings for plotly.js,https://github.com/alexarchambault/plotly-scala,readme,0,,
brimdata/super,[],Go,f7c55279-9d87-5373-bb56-d19316292721,An analytics database that puts JSON and relational tables on equal footing,https://github.com/brimdata/super,readme,0,,
joke2k/django-environ,"['django', 'hacktoberfest', 'python', 'settings', 'twelve-factor']",Python,ac8c014d-c0b1-5dc7-99f9-5731c4be8ff8,Django-environ allows you to utilize 12factor inspired environment variables to configure your Django application.,https://github.com/joke2k/django-environ,readme,0,,
nyggus/makepackage,"['cli', 'package', 'packaging', 'python']",Python,dd55c3b9-0fa8-5eb3-b6bf-42ef846e6776,Package for easy packaging of Python code,https://github.com/nyggus/makepackage,readme,0,,
AnnikaV9/lowbar,"['command-line', 'loading-bar', 'progress-bar', 'python', 'terminal']",Python,6c5f09b7-bee4-52d9-841f-610d7fb1ba95,The simplest no-nonsense progress bar for python,https://github.com/AnnikaV9/lowbar,readme,0,,
schemathesis/schemathesis,"['api', 'api-testing', 'cli', 'fuzzing', 'graphql', 'hypothesis', 'openapi', 'property-based-testing', 'pytest', 'swagger', 'testing']",Python,b88f32a1-97e5-5fcd-8b3d-188829d7a8dc,Catch API bugs before your users do,https://github.com/schemathesis/schemathesis,readme,0,,
flet-dev/flet,"['android', 'cross-platform', 'desktop', 'flutter', 'ios', 'python', 'server-driven-ui', 'web']",Python,4fc878d1-56c3-50c6-81f8-d2124030210d,"Flet enables developers to easily build realtime web, mobile and desktop apps in Python. No frontend experience required.",https://github.com/flet-dev/flet,readme,0,,
microsoft/SynapseML,"['ai', 'apache-spark', 'azure', 'big-data', 'cognitive-services', 'data-science', 'databricks', 'deep-learning', 'http', 'lightgbm', 'machine-learning', 'microsoft', 'ml', 'model-deployment', 'onnx', 'opencv', 'pyspark', 'scala', 'spark', 'synapse']",Scala,9182faf3-42c9-5210-98fa-e29df1dc64c3,Simple and Distributed Machine Learning,https://github.com/microsoft/SynapseML,readme,0,,
HIPS/autograd,[],Python,5b2785bb-d6bf-5907-a008-10728f5347b1,Efficiently computes derivatives of NumPy code.,https://github.com/HIPS/autograd,readme,0,,
openai/baselines,[],Python,c4c128b8-6946-5444-944f-491212c75fc6,OpenAI Baselines: high-quality implementations of reinforcement learning algorithms,https://github.com/openai/baselines,readme,0,,
sybrenjansen/mpire,[],Python,aa08f08f-c7f0-538b-9f69-3e530fbc110c,"A Python package for easy multiprocessing, but faster than multiprocessing",https://github.com/sybrenjansen/mpire,readme,0,,
MaartenGr/BERTopic,"['bert', 'ldavis', 'machine-learning', 'nlp', 'sentence-embeddings', 'topic', 'topic-modeling', 'topic-modelling', 'topic-models', 'transformers']",Python,8f0c8c5d-b635-5fcb-b3ac-7e5fe58d2328,Leveraging BERT and c-TF-IDF to create easily interpretable topics.,https://github.com/MaartenGr/BERTopic,readme,0,,
reuven/live-functional,[],Jupyter Notebook,3f6e2a71-cc17-5c5d-942e-b73f6b472f33,,https://github.com/reuven/live-functional,,0,,
JINO-ROHIT/fastapi_with_celery_redis,[],Python,db2842f3-9688-54e3-8a9a-271407bb08db,"serving a torch model using Celery, Redis and RabbitMQ to serve users asynchronously",https://github.com/JINO-ROHIT/fastapi_with_celery_redis,readme,0,,
urchade/GLiNER,"['information-extraction', 'large-language-models', 'named-entity-recognition', 'natural-language-processing', 'prompt-tuning']",Python,6b6fa71a-98c4-5cc8-a9dc-0ae1f51798e4,Generalist and Lightweight Model for Named Entity Recognition (Extract any entity types from texts) @ NAACL 2024,https://github.com/urchade/GLiNER,readme,0,,
tensorzero/tensorzero,"['ai', 'ai-engineering', 'anthropic', 'artificial-intelligence', 'deep-learning', 'genai', 'generative-ai', 'gpt', 'large-language-models', 'llama', 'llm', 'llmops', 'llms', 'machine-learning', 'ml', 'ml-engineering', 'mlops', 'openai', 'python', 'rust']",Rust,8f6f9f18-b5c0-5996-907c-691293c12d90,"TensorZero is an open-source stack for industrial-grade LLM applications. It unifies an LLM gateway, observability, optimization, evaluation, and experimentation.",https://github.com/tensorzero/tensorzero,readme,0,,
microsoft/maro,"['agent', 'citi-bike', 'docker', 'finance', 'inventory-management', 'logistics', 'maro', 'multi-agent', 'multi-agent-reinforcement-learning', 'operations-research', 'raas', 'reinforcement-learning', 'resource-optimization', 'rl-algorithms', 'simulator', 'transportation']",Python,408106cd-4b2a-580b-9869-13c61dd5d53a,Multi-Agent Resource Optimization (MARO) platform is an instance of Reinforcement Learning as a Service (RaaS) for real-world resource optimization problems.,https://github.com/microsoft/maro,readme,0,,
salesforce/Merlion,"['anomaly-detection', 'automl', 'benchmarking', 'ensemble-learning', 'forecasting', 'machine-learning', 'time-series']",Python,c831192c-59c9-50ab-ba33-ef6f7e8dd5e9,Merlion: A Machine Learning Framework for Time Series Intelligence,https://github.com/salesforce/Merlion,readme,0,,
aio-libs/multidict,"['aiohttp', 'hacktoberfest', 'headers', 'multidict']",Python,f87c8b34-7b91-5fcd-aa67-6031aa685b51,The multidict implementation,https://github.com/aio-libs/multidict,readme,0,,
tensorflow/playground,[],TypeScript,e4fc3905-5706-52d6-b554-bac4fba686f0,Play with neural networks!,https://github.com/tensorflow/playground,readme,0,,
aio-libs/janus,"['asyncio', 'mypy', 'queue', 'threadsafe']",Python,82d0cc21-b75f-5d8d-9ef0-17cef550e553,Thread-safe asyncio-aware queue for Python,https://github.com/aio-libs/janus,readme,0,,
Layout-Parser/layout-parser,"['computer-vision', 'deep-learning', 'detectron2', 'document-image-processing', 'document-layout-analysis', 'layout-analysis', 'layout-detection', 'layout-parser', 'object-detection', 'ocr']",Python,9d731c47-0607-5e39-82b2-1d454661569a,A Unified Toolkit for Deep Learning Based Document Image Analysis,https://github.com/Layout-Parser/layout-parser,readme,0,,
Megvii-BaseDetection/YOLOX,"['deep-learning', 'megengine', 'ncnn', 'object-detection', 'onnx', 'openvino', 'pytorch', 'tensorrt', 'yolo', 'yolov3', 'yolox']",Python,0f3f9984-021a-580e-8156-5ffce69b8d59,"YOLOX is a high-performance anchor-free YOLO, exceeding yolov3~v5 with MegEngine, ONNX, TensorRT, ncnn, and OpenVINO supported. Documentation: https://yolox.readthedocs.io/",https://github.com/Megvii-BaseDetection/YOLOX,readme,0,,
facebookresearch/vissl,[],Jupyter Notebook,ed1e5d25-6ccb-5a09-9e3e-607d8418d0ed,"VISSL is FAIR's library of extensible, modular and scalable components for SOTA Self-Supervised Learning with images.",https://github.com/facebookresearch/vissl,readme,0,,
spiceai/spiceai,"['artificial-intelligence', 'data', 'data-federation', 'developers', 'full-text-search', 'infrastructure', 'llm-inference', 'machine-learning', 'sql']",Rust,893e8a17-21a1-5399-9008-8dda5c64efe2,"A portable accelerated SQL query, search, and LLM-inference engine, written in Rust, for data-grounded AI apps and agents.",https://github.com/spiceai/spiceai,readme,0,,
rentruewang/koila,"['deep-learning', 'gradient-accumulation', 'lazy-evaluation', 'machine-learning', 'memory-management', 'neural-network', 'out-of-memory', 'python', 'pytorch']",Python,80187d33-4723-5912-8eba-6e65f6be6d51,Prevent PyTorch's `CUDA error: out of memory` in just 1 line of code.,https://github.com/rentruewang/koila,readme,0,,
reuven/live-threading,[],Jupyter Notebook,369f3bb8-b7b8-5759-8102-89cf939e2628,,https://github.com/reuven/live-threading,,0,,
reuven/live-asyncio,[],Jupyter Notebook,4cd67e23-575c-5fd0-8a10-471606651cbe,,https://github.com/reuven/live-asyncio,,0,,
reuven/live-projects-oct-2021,[],HTML,9fc0751d-cb48-5452-af7f-7c795f0ab84c,,https://github.com/reuven/live-projects-oct-2021,,0,,
PyGreSQL/PyGreSQL,"['c-extension', 'database', 'database-adapter', 'libpq', 'postgresql', 'python']",Python,5b9f2a2d-f5ab-59f1-b66f-9877beda44c4,The official PyGreSQL repository,https://github.com/PyGreSQL/PyGreSQL,readme,0,,
mljar/mercury,"['data-science', 'data-visualization', 'jupyter', 'jupyter-lab', 'jupyter-notebook', 'mercury', 'mljar-mercury', 'notebook', 'notebook-application', 'notebook-jupyter', 'notebook-publish', 'notebook-web', 'notebooks-jupyter', 'python']",Python,c4327032-2d7e-56ba-be3e-8223a69b3444,Create web apps from Python notebooks,https://github.com/mljar/mercury,readme,0,,
PySport/kloppy,[],Python,6d181fef-3dc7-5724-a5f0-9e333004d83b,kloppy: standardizing soccer tracking- and event data,https://github.com/PySport/kloppy,readme,0,,
tensorflow/gnn,"['deep-learning', 'gnn', 'machine-learning', 'tensorflow']",Python,f0cccedb-c47c-5f4f-88d7-394084b3de71,TensorFlow GNN is a library to build Graph Neural Networks on the TensorFlow platform.,https://github.com/tensorflow/gnn,readme,0,,
PostHog/posthog,"['ab-testing', 'ai-analytics', 'analytics', 'cdp', 'data-warehouse', 'experiments', 'feature-flags', 'javascript', 'product-analytics', 'python', 'react', 'session-replay', 'surveys', 'typescript', 'web-analytics']",Python,8853f60d-ad11-5d81-b243-b60db1d7ed5f,"🦔 PostHog is an all-in-one developer platform for building successful products. We offer product analytics, web analytics, session replay, error tracking, feature flags, experimentation, surveys, data warehouse, a CDP, and an AI product assistant to help debug your code, ship features faster, and keep all your usage and customer data in one stack.",https://github.com/PostHog/posthog,readme,0,,
tensorchord/pgvecto.rs,"['chatgpt', 'faiss', 'gpt', 'hacktoberfest', 'llm', 'nearest-neighbor-search', 'postgres', 'rust', 'vector', 'vector-database']",Rust,012d1391-1411-5021-93ba-429d0079e485,"Scalable, Low-latency and Hybrid-enabled Vector Search in Postgres. Revolutionize Vector Search, not Database.",https://github.com/tensorchord/pgvecto.rs,readme,0,,
BayesianModelingandComputationInPython/BookCode_Edition1,[],Jupyter Notebook,e7c00197-aba3-5d41-8e92-8f96b57d2365,,https://github.com/BayesianModelingandComputationInPython/BookCode_Edition1,readme,0,,
nedbat/cog,[],Python,45103c7a-fcb5-57c9-b35b-9955ee08269a,Small bits of Python computation for static files,https://github.com/nedbat/cog,readme,0,,
JeroenDelcour/tplot,"['python', 'terminal']",Python,a79e9206-d35b-5f9d-9343-d2979eb3e9a9,A library for creating text-based graphs in the terminal,https://github.com/JeroenDelcour/tplot,readme,0,,
facebookresearch/mae,[],Python,f0d6ddce-5686-54bd-ab80-36290c794885,PyTorch implementation of MAE https//arxiv.org/abs/2111.06377,https://github.com/facebookresearch/mae,readme,0,,
isidentical/teyit,[],Python,3ecb8523-6fef-59cc-bf05-813876ffc0f1,Formatter for your Python unit tests,https://github.com/isidentical/teyit,readme,0,,
pykeen/pykeen,"['cuda', 'deep-learning', 'knowledge-base-completion', 'knowledge-graph-embeddings', 'knowledge-graphs', 'link-prediction', 'machine-learning', 'pykeen', 'python', 'torch']",Python,96eaf514-0ad9-567c-9cf5-c3ffe7a43034,🤖 A Python library for learning and evaluating knowledge graph embeddings,https://github.com/pykeen/pykeen,readme,0,,
thoughtworks/mlops-platforms,"['azureml', 'data-science', 'databricks', 'dataiku', 'datarobot', 'google-ai-platform', 'h2oai', 'iguazio', 'knime', 'kubeflow', 'machine-learning', 'mlflow', 'mlops', 'pachyderm', 'sagemaker', 'seldon']",,521f5bd5-e66f-5996-8bfd-9cb3976a14fa,"Compare MLOps Platforms. Breakdowns of SageMaker, VertexAI, AzureML, Dataiku, Databricks, h2o, kubeflow, mlflow...",https://github.com/thoughtworks/mlops-platforms,readme,0,,
spotify/sparkey,[],C,932d2bd6-fe01-59c3-9b75-86aed666f0c2,"Simple constant key/value storage library, for read-heavy systems with infrequent large bulk inserts.",https://github.com/spotify/sparkey,readme,0,,
microsoft/torchscale,"['computer-vision', 'machine-learning', 'multimodal', 'natural-language-processing', 'pretrained-language-model', 'speech-processing', 'transformer', 'translation']",Python,539329e8-2ce9-539b-859b-83efef027b12,Foundation Architecture for (M)LLMs,https://github.com/microsoft/torchscale,readme,0,,
VectifyAI/PageIndex,"['agent', 'agentic-ai', 'ai', 'context-engineering', 'llm', 'rag', 'reasoning', 'retrieval']",Python,fd143ba9-159a-5009-98c6-2477d51c37ee,"📑 PageIndex: Document Index for Vectorless, Reasoning-based RAG",https://github.com/VectifyAI/PageIndex,readme,0,,
bytedance/monolith,[],Python,9d030df1-f9dd-518d-891b-db4fbcec2760,A Lightweight Recommendation System,https://github.com/bytedance/monolith,readme,0,,
sparckles/Robyn,"['async', 'backend', 'hacktoberfest', 'http-server', 'python', 'python3', 'rust', 'web']",Python,a89a5103-ced8-5716-a021-c6b2b416e9b0,Robyn is a Super Fast Async Python Web Framework with a Rust runtime.,https://github.com/sparckles/Robyn,readme,0,,
uTensor/uTensor,"['cortex-m', 'deep-learning', 'edge-computing', 'embedded', 'iot', 'iot-middleware', 'machine-learning', 'mbed', 'microcontroller', 'tensorflow']",C++,1bb2951a-1556-5368-bc32-4c38e68ab0cf,TinyML AI inference library,https://github.com/uTensor/uTensor,readme,0,,
Mause/duckdb_engine,"['duckdb', 'duckdb-engine', 'python', 'sql', 'sqlalchemy']",Python,f2afdb3d-ade6-5a18-8c65-640d95371ee7,SQLAlchemy driver for DuckDB,https://github.com/Mause/duckdb_engine,readme,0,,
petuum/adaptdl,"['aws', 'cloud', 'deep-learning', 'distributed-systems', 'distributed-training', 'kubernetes', 'machine-learning', 'pytorch']",Python,bf0ca9ee-62d3-5ea7-8eab-91c084154cf2,Resource-adaptive cluster scheduler for deep learning training.,https://github.com/petuum/adaptdl,readme,0,,
openai/tiktoken,[],Python,ff9bf526-8df1-51d4-9b84-3d2de627435a,tiktoken is a fast BPE tokeniser for use with OpenAI's models.,https://github.com/openai/tiktoken,readme,0,,
cirospaciari/socketify.py,"['asgi', 'asgi-server', 'asyncio', 'commercial', 'framework', 'http', 'http-server', 'performance', 'proxy-protocol', 'pubsub', 'pypy', 'python', 'python3', 'router', 'socketify', 'websocket', 'websocket-server', 'websockets', 'wsgi', 'wsgi-server']",Python,3dff9ccc-7a3d-52a2-b24b-1995b36a4656,Bringing Http/Https and WebSockets High Performance servers for PyPy3 and Python3,https://github.com/cirospaciari/socketify.py,readme,0,,
jina-ai/serve,"['cloud-native', 'cncf', 'deep-learning', 'docker', 'fastapi', 'framework', 'generative-ai', 'grpc', 'jaeger', 'kubernetes', 'llmops', 'machine-learning', 'microservice', 'mlops', 'multimodal', 'neural-search', 'opentelemetry', 'orchestration', 'pipeline', 'prometheus']",Python,b41c9faf-d64f-5bc0-b702-50cd03b0a717,☁️ Build multimodal AI applications with cloud-native stack,https://github.com/jina-ai/serve,readme,0,,
TauricResearch/TradingAgents,"['agent', 'finance', 'llm', 'multiagent', 'trading']",Python,b179f06f-5c4f-5682-807b-0a35d4eb8296,TradingAgents: Multi-Agents LLM Financial Trading Framework,https://github.com/TauricResearch/TradingAgents,readme,0,,
fastapi/sqlmodel,"['fastapi', 'json', 'json-schema', 'pydantic', 'python', 'sql', 'sqlalchemy']",Python,d638f2a3-9919-5ea8-b021-d6203ec692fb,"SQL databases in Python, designed for simplicity, compatibility, and robustness.",https://github.com/fastapi/sqlmodel,readme,0,,
datapane/datapane,"['dashboard', 'data-visualization', 'python', 'reporting']",Python,7aac00e4-c991-5bfd-908f-99920eb181fc,Build and share data reports in 100% Python,https://github.com/datapane/datapane,readme,0,,
udacity/machine-learning,[],Jupyter Notebook,a0efd7ba-8ab9-5e6e-9efd-936455cd388d,Content for Udacity's Machine Learning curriculum,https://github.com/udacity/machine-learning,readme,0,,
simular-ai/Agent-S,"['agent-computer-interface', 'ai-agents', 'computer-automation', 'computer-use', 'computer-use-agent', 'cua', 'grounding', 'gui-agents', 'in-context-reinforcement-learning', 'memory', 'mllm', 'planning', 'retrieval-augmented-generation']",Python,bde6431c-2bfe-53fc-be3e-de63a7da0f7c,Agent S: an open agentic framework that uses computers like a human,https://github.com/simular-ai/Agent-S,readme,0,,
awsdocs/elastic-beanstalk-samples,[],Python,a43f2431-d0d1-58c5-be88-c6dc361bb8eb,This repository contains code and configuration samples (e.g. .ebextensions) for AWS Elastic Beanstalk.,https://github.com/awsdocs/elastic-beanstalk-samples,readme,0,,
avehtari/BDA_course_Aalto,"['bayes', 'bayesian', 'bayesian-data-analysis', 'bayesian-inference', 'bayesian-methods', 'bayesian-workflow']",TeX,137887e7-7a26-55d6-a235-ba1f2c076f8a,Bayesian Data Analysis course at Aalto,https://github.com/avehtari/BDA_course_Aalto,readme,0,,
pyinfra-dev/pyinfra,"['cloud-management', 'configuration-management', 'high-performance', 'infrastructure', 'pyinfra', 'python', 'remote-execution']",Python,9cf11272-4302-57eb-b5ec-ac7eee887ee3,"🔧 pyinfra turns Python code into shell commands and runs them on your servers. Execute ad-hoc commands and write declarative operations. Target SSH servers, local machine and Docker containers. Fast and scales from one server to thousands.",https://github.com/pyinfra-dev/pyinfra,readme,0,,
petl-developers/petl,[],Python,757519fc-8bc1-54e3-abab-b8a8a2d51ba4,Python Extract Transform and Load Tables of Data,https://github.com/petl-developers/petl,readme,0,,
deanmalmgren/textract,"['data-mining', 'natural-language-processing', 'python', 'text-mining']",HTML,0b546aaa-07f3-567a-8cb7-04e60e9182ca,extract text from any document. no muss. no fuss.,https://github.com/deanmalmgren/textract,readme,0,,
dswah/pyGAM,"['data-science', 'explainable-ai', 'explainable-ml', 'gams', 'hacktoberfest', 'interpretable-ai', 'interpretable-machine-learning', 'interpretable-ml', 'machine-learning', 'python', 'scientific-computing']",Python,69a2db8a-b98e-5e88-9cb1-50fab69c7363,[CONTRIBUTORS WELCOME] Generalized Additive Models in Python,https://github.com/dswah/pyGAM,readme,0,,
thunlp/WantWords,"['natural-language-processing', 'nlp', 'reverse-dictionary', 'word']",JavaScript,c84a4773-e727-5fde-ae18-49d7ea423ceb,An open-source online reverse dictionary.,https://github.com/thunlp/WantWords,readme,0,,
clips/pattern,"['machine-learning', 'natural-language-processing', 'network-analysis', 'python', 'sentiment-analysis', 'web-mining', 'wordnet']",Python,75ca21f2-8f00-5ed8-b0bc-27b88c39a3c8,"Web mining module for Python, with tools for scraping, natural language processing, machine learning, network analysis and visualization.",https://github.com/clips/pattern,readme,0,,
facebook/prophet,"['forecasting', 'python', 'r']",Python,3cff20f1-14cc-5243-9d76-076aeb93cd24,Tool for producing high quality forecasts for time series data that has multiple seasonality with linear or non-linear growth.,https://github.com/facebook/prophet,readme,0,,
automl/auto-sklearn,"['automated-machine-learning', 'automl', 'bayesian-optimization', 'hyperparameter-optimization', 'hyperparameter-search', 'hyperparameter-tuning', 'meta-learning', 'metalearning', 'scikit-learn', 'smac']",Python,512cc60e-562a-5e4e-91a3-5831d9ea2667,Automated Machine Learning with scikit-learn,https://github.com/automl/auto-sklearn,readme,0,,
instillai/machine-learning-course,"['algorithms', 'artificial-intelligence', 'machine-learning', 'machine-learning-algorithms', 'python']",Python,bb1640f2-2bdb-5068-b396-401deea4abc4,:speech_balloon: Machine Learning Course with Python:,https://github.com/instillai/machine-learning-course,readme,0,,
great-expectations/great_expectations,"['cleandata', 'data-engineering', 'data-profilers', 'data-profiling', 'data-quality', 'data-science', 'data-unit-tests', 'datacleaner', 'datacleaning', 'dataquality', 'dataunittest', 'eda', 'exploratory-analysis', 'exploratory-data-analysis', 'exploratorydataanalysis', 'mlops', 'pipeline', 'pipeline-debt', 'pipeline-testing', 'pipeline-tests']",Python,32906ecd-6ae7-5cb7-914b-930743110d0f,Always know what to expect from your data.,https://github.com/great-expectations/great_expectations,readme,0,,
automl/SMAC3,"['algorithm-configuration', 'automated-machine-learning', 'automl', 'bayesian-optimisation', 'bayesian-optimization', 'configuration', 'gaussian-process', 'hyperparameter-optimization', 'hyperparameter-search', 'hyperparameter-tuning', 'random-forest']",Python,a2aeb0f7-6644-5461-9945-4484ea7762af,SMAC3: A Versatile Bayesian Optimization Package for Hyperparameter Optimization,https://github.com/automl/SMAC3,readme,0,,
