repo,topics,language,id,description,url,doc_source,score,is_a_curated_list,is_not_a_library
PrithivirajDamodaran/FlashRank,"['cross-encoder', 'full-text-search', 'hybrid-search', 'lexical-search', 'rag', 'ranking', 'reranking', 'retrieval-augmented-generation', 'semantic-search', 'vector-database', 'vector-search']",Python,e475f4f5-b3c8-565c-b687-d56749534ede,"Lite & Super-fast re-ranking for your search & retrieval pipelines.  Supports SoTA Listwise and Pairwise reranking based on LLMs and  cross-encoders and more.  Created by Prithivi Da, open for PRs & Collaborations.",https://github.com/PrithivirajDamodaran/FlashRank,readme,0.584391,,
togethercomputer/RedPajama-Data,[],Python,4a065103-8c54-530d-8cf4-efab7fa16c36,The RedPajama-Data repository contains code for preparing large datasets for training large language models.,https://github.com/togethercomputer/RedPajama-Data,readme,0.5842248,,
snorkel-team/snorkel,"['ai', 'data-augmentation', 'data-science', 'data-slicing', 'labeling', 'machine-learning', 'python', 'snorkel', 'training-data', 'weak-supervision']",Python,d842a624-d88b-5b3d-9000-363061e4c61d,A system for quickly generating training data with weak supervision,https://github.com/snorkel-team/snorkel,readme,0.58074623,,
rhiever/datacleaner,"['automation', 'data-science', 'machine-learning', 'python']",Python,9b92e92a-6802-54f1-b63d-6ec42eecac12,A Python tool that automatically cleans data sets and readies them for analysis.,https://github.com/rhiever/datacleaner,readme,0.58074623,,
fastmachinelearning/hls4ml,"['fpga', 'hls', 'intel-hls', 'keras', 'machine-learning', 'neural-network', 'onnx', 'python', 'pytorch', 'vivado', 'vivado-hls']",Python,e8224e05-99bd-597b-ac3f-02c55b9da18d,Machine learning on FPGAs using HLS,https://github.com/fastmachinelearning/hls4ml,readme,0.58025396,,
pipeless-ai/pipeless,"['artificial-intelligence', 'cloud', 'computer-vision', 'deep-learning', 'ffmpeg', 'gstreamer', 'inference', 'inference-server', 'machine-learning', 'multimedia', 'multimedia-applications', 'object-detection', 'perception', 'pipeline-framework', 'python', 'stream-processing', 'video', 'video-processing', 'vision-framework', 'yolo']",Rust,7d8d8f5a-2148-5f6a-956b-b118bd1c8416,An open-source computer vision framework to build and deploy apps in minutes,https://github.com/pipeless-ai/pipeless,readme,0.58000815,,
usv240/timetracer,"['api', 'cassette', 'debugging', 'fastapi', 'flask', 'http', 'mocking', 'python', 'replay', 'testing']",Python,d52942b3-3844-56ef-bad5-147db747f11a,"Time-travel debugging for FastAPI and Flask - Record API requests, replay with mocked dependencies",https://github.com/usv240/timetracer,readme,0.57878214,,
cohere-ai/cohere-python,"['python', 'sdk']",Python,12597ad3-0b1b-57eb-a273-b655273a2ccb,Python Library for Accessing the Cohere API,https://github.com/cohere-ai/cohere-python,readme,0.57875496,,
otto-de/recsys-dataset,"['benchmark', 'dataset', 'e-commerce', 'kaggle', 'machine-learning', 'multi-objective-optimization', 'otto', 'recommendation-system', 'recommendations', 'recommender-system', 'recsys', 'session-based']",Python,d86dc27a-f0df-5577-b6bf-77aa5bc06a81,🛍 A real-world e-commerce dataset for session-based recommender systems research.,https://github.com/otto-de/recsys-dataset,readme,0.5775614,,
kitao/pyxel,"['game', 'game-development', 'game-engine', 'gamedev', 'graphics', 'html', 'opengl', 'pico-8', 'pixel-art', 'python', 'pyxel', 'rust', 'tic-80', 'webgl']",Rust,68da46ab-be23-5947-9dd0-5d5070fef4c4,A retro game engine for Python,https://github.com/kitao/pyxel,readme,0.5766784,,
ksonda/global-river-runner,[],Python,8c63ed6b-1427-5ce5-b0fb-0771aa99d319,Let's make a global river runner,https://github.com/ksonda/global-river-runner,readme,0.5748669,,
samuelcolvin/dirty-equals,"['pytest', 'python', 'testing-tools', 'unit-testing']",Python,1df46b5b-562a-5698-91db-3ebe6fffde2f,Doing dirty (but extremely useful) things with equals.,https://github.com/samuelcolvin/dirty-equals,readme,0.57390296,,
sterglee/scalalab,[],Scala,af84003d-5e3a-5c26-b2fc-8639d3dc2594,ScalaLab: Efficient MATLAB like scientific computing for the Java platform with the current Scala 2.13. For Scala 3 the equivalent project is dottylab: https://github.com/sterglee/dottylab,https://github.com/sterglee/scalalab,readme,0.57296896,,
pypa/pipx,"['cli', 'hacktoberfest', 'pip', 'pypi', 'python', 'venv']",Python,8a9f03fa-25e3-5874-8287-47eaacf8ed95,Install and Run Python Applications in Isolated Environments,https://github.com/pypa/pipx,readme,0.5719052,,
mxgmn/MarkovJunior,"['algorithms', 'cellular-automata', 'csharp', 'gamedev', 'language', 'markovjunior', 'probabilistic-programming', 'procedural-generation', 'voxel']",C#,510e2f0f-6d13-5eba-9b2a-1f2bb881e31d,"Probabilistic language based on pattern matching and constraint propagation, 153 examples",https://github.com/mxgmn/MarkovJunior,readme,0.57069206,,
DEAP/deap,[],Python,7bfbe2d1-9a74-55fd-91b1-ca35366e23f3,Distributed Evolutionary Algorithms in Python,https://github.com/DEAP/deap,readme,0.570273,,
facebookresearch/dynalab,[],Python,9858d898-be94-5195-a670-8b3b16444018,"The Python library with command line tools to interact with Dynabench(https://dynabench.org/), such as uploading models. ",https://github.com/facebookresearch/dynalab,readme,0.5701059,,
dtiesling/flask-muck,"['crud', 'flask', 'flask-extension', 'framework', 'marshmallow', 'openapi', 'pydantic', 'rest', 'restful-api', 'sqlalchemy']",Python,3f5ea708-d07b-5778-b614-7d89d0c24cab,"🧹 Flask REST framework for generating CRUD APIs and OpenAPI specs in the SQLAlchemy, Marshmallow/Pydantic application stack.",https://github.com/dtiesling/flask-muck,readme,0.5696316,,
dcmoura/spyql,"['command-line', 'csv', 'data', 'json', 'python', 'sql', 'text']",Jupyter Notebook,5973fee6-b46d-501c-9f87-8c37a1d8c29d,Query data on the command line with SQL-like SELECTs powered by Python expressions,https://github.com/dcmoura/spyql,readme,0.5694823,,
jfilter/clean-text,"['natural-language-processing', 'nlp', 'python', 'python-package', 'scraping', 'text-cleaning', 'text-normalization', 'text-preprocessing', 'user-generated-content']",Python,d8bbdb8d-b504-593c-9a10-655ceaf57bfa,🧹 Python package for text cleaning,https://github.com/jfilter/clean-text,readme,0.568449,,
cvjena/deic,"['computer-vision', 'data-efficient-learning', 'deep-learning', 'image-classification']",Jupyter Notebook,135cfb2c-4e77-56b5-ab32-13c3172ae025,Benchmark for Data-Efficient Image Classification,https://github.com/cvjena/deic,readme,0.5681869,,
explosion/prodigy-recipes,"['active-learning', 'annotation', 'annotation-tool', 'artificial-intelligence', 'computer-vision', 'data-annotation', 'data-science', 'labeling-tool', 'machine-learning', 'machine-teaching', 'natural-language-processing', 'nlp', 'prodigy', 'spacy']",Jupyter Notebook,8a06483a-fac0-5937-8d51-46d5376e0b12,"🍳 Recipes for the Prodigy, our fully scriptable annotation tool",https://github.com/explosion/prodigy-recipes,readme,0.5679773,,
tensorflow/agents,"['bandits', 'contextual-bandits', 'dqn', 'multi-armed-bandits', 'reinforcement-learning', 'rl-algorithms', 'tensorflow', 'tf-agents']",Python,408636da-c041-5e89-82b1-269842bbf3ec,"TF-Agents: A reliable, scalable and easy to use TensorFlow library for Contextual Bandits and Reinforcement Learning.",https://github.com/tensorflow/agents,readme,0.5675065,,
usagitoneko97/klara,"['ast', 'cfg', 'python', 'ssa', 'static-analysis', 'static-code-analysis']",Python,0504e87e-1036-581d-8fcb-56d30b1346ef,Automatic test case generation for python and static analysis library,https://github.com/usagitoneko97/klara,readme,0.5675065,,
shenweichen/DeepMatch,"['collaborative-filtering', 'comirec', 'dssm', 'factorization-machines', 'matching', 'mind', 'recommendation', 'youtubednn']",Python,6aad844a-0b0e-5891-bbd4-578d378afc16,A deep matching model library for recommendations & advertising. It's easy to train models and to export representation vectors which can be used for ANN search.,https://github.com/shenweichen/DeepMatch,readme,0.56630677,,
google-deepmind/dm-haiku,"['deep-learning', 'deep-neural-networks', 'jax', 'machine-learning', 'neural-networks']",Python,888a98e7-f43e-53b5-b8b1-bdc4e576b89a,JAX-based neural network library,https://github.com/google-deepmind/dm-haiku,readme,0.56412894,,
FactoryBoy/factory_boy,"['django', 'fixtures', 'hacktoberfest', 'python', 'sqlalchemy', 'testing']",Python,0ec17f11-b74b-522b-ab3e-e60587db601b,A test fixtures replacement for Python,https://github.com/FactoryBoy/factory_boy,readme,0.56369877,,
long2ice/fastapi-cache,"['cache', 'fastapi', 'memcached', 'redis']",Python,d86ffaec-0ae8-524d-a49c-c2ffa4abcdc5,"fastapi-cache is a tool to cache fastapi response and function result, with backends support redis and memcached.",https://github.com/long2ice/fastapi-cache,readme,0.56330365,,
HazyResearch/spacetime,[],Python,9c82f161-f556-5327-a5f0-9b7cac1ca477,"Code for SpaceTime 🌌⏱️. Proposed in Effectively Modeling Time Series with Simple Discrete State Spaces, ICLR 2023.",https://github.com/HazyResearch/spacetime,readme,0.5626092,,
dmlc/dgl,"['deep-learning', 'graph-neural-networks']",Python,1cf5aebd-421b-5f51-b89c-8a26ffc68274,"Python package built to ease deep learning on graph, on top of existing DL frameworks.",https://github.com/dmlc/dgl,readme,0.5626083,,
metarank/metarank,"['automl', 'data-engineering', 'data-science', 'deep-learning', 'feature-engineering', 'feature-extraction', 'kubernetes', 'machine-learning', 'neural-networks', 'personalization', 'ranking', 'scala', 'search']",Scala,67bf6df4-b1b3-5d87-8111-3be4b0c29f1c,"A low code Machine Learning personalized ranking service for articles, listings, search results, recommendations that boosts user engagement. A friendly Learn-to-Rank engine",https://github.com/metarank/metarank,readme,0.561686,,
cmaron/CS-7641-assignments,"['cs7641', 'georgia-tech', 'hacktoberfest', 'machine-learning', 'ml', 'omscs', 'python', 'sklearn']",Java,71a581fe-6d39-56f6-ab25-c3428586f65f,CS 7641 - All the code,https://github.com/cmaron/CS-7641-assignments,readme,0.56119996,,
AllenDowney/ThinkDSP,[],Jupyter Notebook,720cb111-3644-53a9-8590-3be7b024c450,"Think DSP: Digital Signal Processing in Python, by Allen B. Downey.",https://github.com/AllenDowney/ThinkDSP,readme,0.5591626,,
datasciencemasters/go,[],,ec85bbfa-0db6-550c-852a-1b5a4d6c6b9c,The Open Source Data Science Masters,https://github.com/datasciencemasters/go,readme,0.55849093,,
lux-org/lux,"['data-science', 'exploratory-data-analysis', 'jupyter', 'pandas', 'python', 'visualization', 'visualization-tools']",Python,5928ca30-2b93-5ed4-b9d8-27ced518f25e,Automatically visualize your pandas dataframe via a single print! 📊 💡,https://github.com/lux-org/lux,readme,0.5584783,,
PyMySQL/PyMySQL,"['mysql', 'python']",Python,2761eab4-b3a6-56fe-b894-0958f9be2772,MySQL client library for Python,https://github.com/PyMySQL/PyMySQL,readme,0.558453,,
pydantic/pydantic,"['hints', 'json-schema', 'parsing', 'pydantic', 'python', 'python310', 'python311', 'python312', 'python313', 'python39', 'validation']",Python,f8a9c90a-b3db-5f75-ba80-36a111acfe41,Data validation using Python type hints,https://github.com/pydantic/pydantic,readme,0.5579978,,
domokane/FinancePy,"['asset-allocation', 'bonds', 'credit', 'currency', 'derivatives', 'derivatives-pricing', 'finance', 'fixed-income', 'investment', 'numba', 'pricing', 'python', 'risk', 'risk-management', 'students', 'valuation']",Jupyter Notebook,55d4e669-6f41-58fc-9417-e80067c9aa6d,"A Python Finance Library that focuses on the pricing and risk-management of Financial Derivatives, including fixed-income, equity, FX and credit derivatives. ",https://github.com/domokane/FinancePy,readme,0.5564355,,
fabsig/GPBoost,"['artificial-intelligence', 'boosting', 'cpp', 'data-science', 'gaussian-processes', 'machine-learning', 'mixed-effects', 'python', 'r']",C++,20454c49-df94-5e60-87c0-cc766f2078ae,"Tree-Boosting, Gaussian Processes, and Mixed-Effects Models",https://github.com/fabsig/GPBoost,readme,0.553959,,
Zero-True/zero-true,"['ai', 'artificial-intelligence', 'data', 'data-analysis', 'data-science', 'data-visualization', 'machine-learning', 'machinelearning', 'notebook', 'notebook-publish', 'notebooks', 'python', 'python-dashboard']",Vue,97e95385-b8ee-5490-bdbb-f40580b60560,Zero-True: A collaborative notebook built for data scientists,https://github.com/Zero-True/zero-true,readme,0.5539341,,
celery/celery,"['amqp', 'python', 'python-library', 'python3', 'queue-tasks', 'queue-workers', 'queued-jobs', 'redis', 'redis-queue', 'sqs', 'sqs-queue', 'task-manager', 'task-runner', 'task-scheduler']",Python,4d24e112-e721-54ab-92bd-46c1a27f49f6,Distributed Task Queue (development branch),https://github.com/celery/celery,readme,0.55341166,,
nvbn/thefuck,"['python', 'shell']",Python,854bd726-0172-5c57-a85d-f97f9c43967c,Magnificent app which corrects your previous console command.,https://github.com/nvbn/thefuck,readme,0.55307215,,
mshumer/gpt-investor,[],Jupyter Notebook,2d6e247b-fe40-5e8b-b7c6-904e1bb008e4,,https://github.com/mshumer/gpt-investor,readme,0.552147,,
macbre/sql-metadata,"['database', 'hive', 'hiveql', 'metadata', 'mysql-query', 'parser', 'python-package', 'python3-library', 'sql', 'sql-parser', 'sqlparse']",Python,8e56d251-9fb9-5b85-8c52-212bcfc93dc5,Uses tokenized query returned by python-sqlparse and generates query metadata,https://github.com/macbre/sql-metadata,readme,0.55172664,,
alibaba/zvec,"['ann-search', 'embedded-database', 'rag', 'vector-search', 'vectordb']",C++,482c49a2-0800-5903-9ba3-27a98bca7348,"A lightweight, lightning-fast, in-process vector database",https://github.com/alibaba/zvec,readme,0.5503713,,
m1guelpf/tinyvector,"['embeddings', 'embeddings-similarity', 'machine-learning', 'rust', 'search-engines', 'similarity-search', 'vector-database', 'vector-search']",Rust,a1aac0d6-7e77-57ff-b8d0-22740bd318f1,A tiny embedding database in pure Rust.,https://github.com/m1guelpf/tinyvector,readme,0.54860705,,
gchq/ConcourseTools,"['concourse-ci', 'concourse-ci-resource', 'concourse-resource', 'concourse-resources']",Python,20ec1daf-0cc4-52ab-a49f-062345569bc2,A Python package for easily implementing Concourse resource types.,https://github.com/gchq/ConcourseTools,readme,0.5481677,,
PrefectHQ/marvin,"['agents', 'ai', 'ambient-ai', 'chatbots', 'gpt', 'llm', 'nli', 'python', 'structured-outputs']",Python,7641448c-e69d-5888-addb-b4b5a30ba8b2,an ambient intelligence library,https://github.com/PrefectHQ/marvin,readme,0.5479077,,
cylondata/cylon,"['data', 'dataframe', 'dataframes-api', 'deep-learning', 'join', 'mpi', 'preprocessing', 'shuffle']",C++,7239a7bf-c199-54ed-b33d-6a130469ac1b,"Cylon is a fast, scalable, distributed memory, parallel runtime with a Pandas like DataFrame.",https://github.com/cylondata/cylon,readme,0.54772913,,
intel/ipex-llm,"['gpu', 'llm', 'pytorch', 'transformers']",Python,7e0d6de0-8647-50d1-9365-349179a06c11,"Accelerate local LLM inference and finetuning (LLaMA, Mistral, ChatGLM, Qwen, DeepSeek, Mixtral, Gemma, Phi, MiniCPM, Qwen-VL, MiniCPM-V, etc.) on Intel XPU (e.g., local PC with iGPU and NPU, discrete GPU such as Arc, Flex and Max); seamlessly integrate with llama.cpp, Ollama, HuggingFace, LangChain, LlamaIndex, vLLM, DeepSpeed, Axolotl, etc.",https://github.com/intel/ipex-llm,readme,0.5471778,,
triton-lang/triton,[],MLIR,7b1f81b1-d75b-53fc-89d3-143cdb344a92,Development repository for the Triton language and compiler,https://github.com/triton-lang/triton,readme,0.5468864,,
intel/intel-extension-for-transformers,"['4-bits', 'autoround', 'chatbot', 'chatpdf', 'gaudi3', 'habana', 'intel-optimized-llamacpp', 'large-language-model', 'llm-cpu', 'llm-inference', 'neural-chat', 'neural-chat-7b', 'rag', 'retrieval', 'speculative-decoding', 'streamingllm']",Python,a9119954-7600-525d-a5ac-fe02fc6bafce,⚡ Build your chatbot within minutes on your favorite device; offer SOTA compression techniques for LLMs; run LLMs efficiently on Intel Platforms⚡,https://github.com/intel/intel-extension-for-transformers,readme,0.54674083,,
bregman-arie/devops-exercises,"['ansible', 'aws', 'azure', 'coding', 'containers', 'devops', 'docker', 'git', 'interview', 'interview-questions', 'kubernetes', 'linux', 'openstack', 'production-engineer', 'prometheus', 'python', 'sql', 'sre', 'terraform']",Python,daf15ad3-432c-5bfc-903c-9bd5171bbf1d,"Linux, Jenkins, AWS, SRE, Prometheus, Docker, Python, Ansible, Git, Kubernetes, Terraform, OpenStack, SQL, NoSQL, Azure, GCP, DNS, Elastic, Network, Virtualization. DevOps Interview Questions",https://github.com/bregman-arie/devops-exercises,readme,0.54623586,,
nickjj/docker-django-example,"['celery', 'django', 'docker', 'docker-compose', 'esbuild', 'postgres', 'redis', 'tailwindcss']",Python,70a58909-4a92-5ee6-92a2-cdcd54fc02e7,A production ready example Django app that's using Docker and Docker Compose.,https://github.com/nickjj/docker-django-example,readme,0.54557884,,
Kanaries/pygwalker,"['data-analysis', 'data-exploration', 'dataframe', 'matplotlib', 'pandas', 'plotly', 'tableau', 'tableau-alternative', 'visualization']",Python,fd017810-9b71-59cc-a892-68655df4952e,PyGWalker: Turn your dataframe into an interactive UI for visual analysis,https://github.com/Kanaries/pygwalker,readme,0.5452891,,
mikeckennedy/pythons-gc-and-orms,[],Python,f6e20b75-4017-5a85-a88b-23060a76c3b9,A simple project to explore the number of GCs when doing basic ORM work.,https://github.com/mikeckennedy/pythons-gc-and-orms,readme,0.54511225,,
gorgonia/gorgonia,"['artificial-intelligence', 'automatic-differentiation', 'computation-graph', 'deep-learning', 'deep-neural-networks', 'deeplearning', 'differentiation', 'go', 'golang', 'gorgonia', 'gradient-descent', 'graph-computation', 'hacktoberfest', 'machine-learning', 'neural-network', 'symbolic-differentiation']",Go,13864329-f71c-5445-8333-2c252417673c,Gorgonia is a library that helps facilitate machine learning in Go.,https://github.com/gorgonia/gorgonia,readme,0.54384506,,
chesterli29/jupyterlab_tensorboard,"['jupyterlab', 'jupyterlab-extension', 'tensorboard']",TypeScript,c10639fb-8e4f-588b-81dc-4aa00e786c5b,Tensorboard extension for jupyterlab.,https://github.com/chesterli29/jupyterlab_tensorboard,readme,0.54381305,,
dunovank/jupyter-themes,"['css', 'jupyter', 'jupyter-notebook', 'jupyter-themes', 'syntax-highlighting', 'theme']",CSS,374bcc9a-2cb2-5520-8c3a-af26ed20d1cf,Custom Jupyter Notebook Themes,https://github.com/dunovank/jupyter-themes,readme,0.5421144,,
maximtrp/scikit-posthocs,"['posthoc-comparisons', 'posthoc-tests', 'python', 'scikit', 'statistical-analysis', 'statistics', 'stats']",Python,2ae09d81-a655-51db-94da-d5f9ec38e20d,Multiple Pairwise Comparisons (Post Hoc) Tests in Python,https://github.com/maximtrp/scikit-posthocs,readme,0.5412651,,
kitlangton/scala-update,[],Scala,f81da7df-dbbd-58f3-9480-2b3e389e6b23,Update your Scala dependencies interactively,https://github.com/kitlangton/scala-update,readme,0.5403789,,
gaogaotiantian/watchpoints,"['debugging', 'debugging-tool', 'python', 'python3']",Python,626657d1-93cf-5ae8-863a-f8ced9d2e820,"watchpoints is an easy-to-use, intuitive variable/object monitor tool for python that behaves similar to watchpoints in gdb.",https://github.com/gaogaotiantian/watchpoints,readme,0.5397634,,
DataTalksClub/stock-markets-analytics-zoomcamp,[],Jupyter Notebook,f49df5d7-1eea-5362-a639-69dff31bf90a,Course Materials for Analytics in Stock Markets Zoomcamp,https://github.com/DataTalksClub/stock-markets-analytics-zoomcamp,readme,0.5397634,,
satwikkansal/wtfpython,"['documentation', 'gotchas', 'interview-questions', 'pitfalls', 'python', 'python-interview-questions', 'snippets', 'wats', 'wtf']",Python,d71c6cc0-35c5-525c-a7e4-ff7dcddd6364,What the f*ck Python? 😱,https://github.com/satwikkansal/wtfpython,readme,0.53924376,,
rmcelreath/stat_rethinking_2023,[],R,27d30ca9-8532-59c1-a528-973afe905307,Statistical Rethinking Course for Jan-Mar 2023,https://github.com/rmcelreath/stat_rethinking_2023,readme,0.538678,,
pytorch/torcharrow,"['preprocessing', 'python', 'pytorch']",Python,0dc5e2d9-7561-5161-b7fb-efdba91c2aac,High performance model preprocessing library on PyTorch,https://github.com/pytorch/torcharrow,readme,0.53825444,,
alexmojaki/heartrate,"['debugger', 'python', 'visualization']",Python,a7ee400d-de8b-5945-87e4-4abd7b3fc652,Simple real time visualisation of the execution of a Python program.,https://github.com/alexmojaki/heartrate,readme,0.53783154,,
sohiniroych/Unet-using-TF2,[],Jupyter Notebook,2fc18925-ade0-5ff5-bbca-8c3ad8432208,This example demonstrates the use of U-net model for retinal blood vessel segmentation on tensorflow 2.x,https://github.com/sohiniroych/Unet-using-TF2,readme,0.53740937,,
crewAIInc/crewAI,"['agents', 'ai', 'ai-agents', 'aiagentframework', 'llms']",Python,29257b05-3eba-5c2a-9ce7-df1edb727e81,"Framework for orchestrating role-playing, autonomous AI agents. By fostering collaborative intelligence, CrewAI empowers agents to work together seamlessly, tackling complex tasks.",https://github.com/crewAIInc/crewAI,readme,0.53736246,,
guillaume-chevalier/seq2seq-signal-prediction,"['python', 'seq2seq', 'tensorflow', 'tensorflow-tutorials']",Jupyter Notebook,055b00b6-98c4-5a5d-a05e-1f6d39784381,Signal forecasting with a Sequence-to-Sequence (seq2seq) Recurrent Neural Network (RNN) model in TensorFlow - Guillaume Chevalier,https://github.com/guillaume-chevalier/seq2seq-signal-prediction,readme,0.536352,,
microsoft/onnxjs,[],TypeScript,6f18c142-dc07-5c85-97f4-95fa2ea88374,ONNX.js: run ONNX models using JavaScript,https://github.com/microsoft/onnxjs,readme,0.53512216,,
justmarkham/scikit-learn-tips,"['data-school', 'data-science', 'machine-learning', 'python', 'scikit-learn']",Jupyter Notebook,02a80e15-e75d-57dc-9bc1-d06cb5a31273,:robot::zap: 50 scikit-learn tips,https://github.com/justmarkham/scikit-learn-tips,readme,0.5348899,,
networkx/networkx,"['complex-networks', 'graph-algorithms', 'graph-analysis', 'graph-generation', 'graph-theory', 'graph-visualization', 'python']",Python,2975e1de-08d1-5e00-98de-ad6a3d418e99,Network Analysis in Python,https://github.com/networkx/networkx,readme,0.5344722,,
joshpxyne/gpt-migrate,[],Python,57d4c632-479e-5d46-829d-6c959747eb82,Easily migrate your codebase from one framework or language to another.,https://github.com/joshpxyne/gpt-migrate,readme,0.5332464,,
python-visualization/folium,"['data-science', 'data-visualization', 'javascript', 'maps', 'python']",Python,f3e2fad6-7861-55c5-9602-8d9d78657c7d,Python Data. Leaflet.js Maps.,https://github.com/python-visualization/folium,readme,0.5332233,,
fastapi/fastapi,"['api', 'async', 'asyncio', 'fastapi', 'framework', 'json', 'json-schema', 'openapi', 'openapi3', 'pydantic', 'python', 'python-types', 'python3', 'redoc', 'rest', 'starlette', 'swagger', 'swagger-ui', 'uvicorn', 'web']",Python,d415c2c7-5fda-5d0d-bcbd-9ab556248a03,"FastAPI framework, high performance, easy to learn, fast to code, ready for production",https://github.com/fastapi/fastapi,readme,0.53283894,,
determined-ai/determined,"['data-science', 'deep-learning', 'distributed-training', 'hyperparameter-optimization', 'hyperparameter-search', 'hyperparameter-tuning', 'keras', 'kubernetes', 'machine-learning', 'ml-infrastructure', 'ml-platform', 'mlops', 'pytorch', 'tensorflow']",Go,1d4c2a3f-11dd-5a88-8632-f0c81984c1dd,"Determined is an open-source machine learning platform that simplifies distributed training, hyperparameter tuning, experiment tracking, and resource management. Works with PyTorch and TensorFlow.",https://github.com/determined-ai/determined,readme,0.53198016,,
clementchadebec/benchmark_VAE,"['benchmarking', 'beta-vae', 'comparison', 'normalizing-flows', 'pixel-cnn', 'pytorch', 'reproducibility', 'reproducible-research', 'vae', 'vae-gan', 'vae-implementation', 'vae-pytorch', 'variational-autoencoder', 'vq-vae', 'wasserstein-autoencoder']",Python,54863f52-236a-50e8-80ba-f7588dc20df6,Unifying Variational Autoencoder (VAE) implementations in Pytorch (NeurIPS 2022),https://github.com/clementchadebec/benchmark_VAE,readme,0.5312921,,
facebookarchive/skybison,[],C++,eaa418ea-1325-51ee-af44-d09a58208650,Instagram's experimental performance oriented greenfield implementation of Python.,https://github.com/facebookarchive/skybison,readme,0.53033173,,
ClickHouse/ClickHouse,"['ai', 'analytics', 'big-data', 'clickhouse', 'cloud-native', 'cpp', 'database', 'dbms', 'distributed', 'embedded', 'hacktoberfest', 'lakehouse', 'mpp', 'olap', 'rust', 'self-hosted', 'sql']",C++,5bd393d5-2d3e-58f8-b27e-1f7eb4ac4f2c,ClickHouse® is a real-time analytics database management system,https://github.com/ClickHouse/ClickHouse,readme,0.52910197,,
tensorflow/tensor2tensor,"['deep-learning', 'machine-learning', 'machine-translation', 'reinforcement-learning', 'tpu']",Python,2aae1072-fdf8-5b87-ba55-98e8b6a76083,Library of deep learning models and datasets designed to make deep learning more accessible and accelerate ML research.,https://github.com/tensorflow/tensor2tensor,readme,0.5285875,,
google-deepmind/xmanager,[],Python,c331625e-b1a3-5e7f-88a2-1b3a810edd56,A platform for managing machine learning experiments,https://github.com/google-deepmind/xmanager,readme,0.5279006,,
probml/sts-jax,[],Jupyter Notebook,d89f5c8f-4a61-520d-88f5-afd65765079d,Structural Time Series in JAX,https://github.com/probml/sts-jax,readme,0.52769715,,
pdpipe/pdpipe,"['data', 'data-science', 'dataframe', 'dataframes', 'pandas', 'pandas-dataframe', 'pipeline']",Jupyter Notebook,ed72214a-8fcb-5c30-9eda-51859e386f2b,Easy pipelines for pandas DataFrames.,https://github.com/pdpipe/pdpipe,readme,0.5274938,,
jupyter/nbconvert,[],Python,35d8354b-884d-5e99-ac29-f9e37490c3d0,Jupyter Notebook Conversion,https://github.com/jupyter/nbconvert,readme,0.52747124,,
